movie_id,title,year,certificate,runtime_minutes,genre,rating,metascore,description,director,stars,votes,gross_millions
tt1000894,Last Dreams 787,2022,G,113,Adventure,7.5,61.0,A critically acclaimed adventure masterpiece.,Kathryn Bigelow,"Zendaya, Al Pacino, Meryl Streep, Christian Bale",98971,496.0
tt1000812,First Destiny 705,2021,PG,117,Adventure,7.5,72.0,An epic adventure tale directed by Steven Spielberg.,Steven Spielberg,"Amy Adams, Johnny Depp, Will Smith, Timothée Chalamet",31096,
tt1000192,A Mission 85,1996,PG-13,124,Horror,7.5,64.0,A thrilling horror adventure.,Stanley Kubrick,"Anthony Hopkins, Chris Hemsworth, Scarlett Johansson, Jennifer Lawrence, Robert Downey Jr.",6516,
tt1000938,An Revolution 831,2024,R,156,Comedy,7.5,81.0,A comedy film set in 2024.,David Fincher,"Anthony Hopkins, Leonardo DiCaprio, Christian Bale, Florence Pugh",123389,346.51
tt1000523,Last Dreams 416,2011,PG,109,"War, Mystery",7.5,86.0,A thrilling war adventure.,Coen Brothers,"Gary Oldman, Mark Ruffalo, Viola Davis, Harrison Ford",9123,217.68
tt1000493,Lost Secrets 386,2022,Not Rated,111,"Documentary, Action, Western",7.5,90.0,An epic documentary tale directed by George Lucas.,George Lucas,"Matt Damon, Robert De Niro, Florence Pugh",34226,179.08
tt1000521,Dark Awakening 414,2013,R,137,"Romance, Biography",7.5,,An epic romance tale directed by Spike Lee.,Spike Lee,"Florence Pugh, Samuel L. Jackson, Robert De Niro, Leonardo DiCaprio",39261,336.96
tt1000302,Lost Chronicles 195,2004,PG-13,92,"Horror, Fantasy",7.5,,A thrilling horror adventure.,Kathryn Bigelow,"Johnny Depp, Zendaya, Robert Downey Jr.",157664,
tt1000485,Lost Secrets 378,2013,PG-13,84,"Adventure, Animation",7.5,,A critically acclaimed adventure masterpiece.,Clint Eastwood,"Edward Norton, Johnny Depp, Harrison Ford, Natalie Portman, Robert De Niro",106057,134.93
tt1000820,Dark Mission 713,2013,PG,121,"Romance, Horror, Crime",7.5,,A thrilling romance adventure.,Steven Spielberg,"Gary Oldman, Al Pacino, Florence Pugh",123423,
tt1000803,The War 696,2002,G,97,"Comedy, Mystery, Thriller",7.5,78.0,A critically acclaimed comedy masterpiece.,Ridley Scott,"Jennifer Lawrence, Robert De Niro, Matt Damon",601329,
tt1000802,Final War 695,2021,PG-13,94,"Documentary, War",7.5,68.0,An epic documentary tale directed by Ava DuVernay.,Ava DuVernay,"Zendaya, Samuel L. Jackson, Mark Ruffalo",202216,193.82
tt1000620,Dark Destiny 513,2008,PG,117,Adventure,7.5,61.0,A thrilling adventure adventure.,Quentin Tarantino,"Morgan Freeman, Meryl Streep, Matt Damon",196857,252.52
tt1000683,First War 576,2003,R,123,"Thriller, Animation",7.5,,A thrilling thriller adventure.,Christopher Nolan,"Margot Robbie, Brad Pitt, Keanu Reeves",16306,50.49
tt1000640,An Empire 533,2001,PG-13,80,"Fantasy, Biography",7.5,69.0,A critically acclaimed fantasy masterpiece.,Denis Villeneuve,"Scarlett Johansson, Robert Downey Jr., Viola Davis, Daniel Day-Lewis",11978,138.91
tt1000624,First Story 517,2023,R,113,"Crime, Animation",7.5,63.0,A thrilling crime adventure.,Martin Scorsese,"Johnny Depp, Anthony Hopkins, Al Pacino, Robert De Niro, Scarlett Johansson",427394,294.93
tt1000594,Last Secrets 487,2007,PG-13,89,"Western, Thriller",7.5,69.0,An epic western tale directed by Steven Spielberg.,Steven Spielberg,"Johnny Depp, Jennifer Lawrence, Christian Bale",67755,
tt1000671,First Story 564,2010,PG,101,Crime,7.5,71.0,A critically acclaimed crime masterpiece.,Kathryn Bigelow,"Kate Winslet, Samuel L. Jackson, Al Pacino, Viola Davis",44768,419.28
tt1000663,The Love 556,2006,PG-13,128,"Drama, Crime",7.5,,A drama film set in 2006.,George Lucas,"Leonardo DiCaprio, Chris Hemsworth, Timothée Chalamet",185616,97.71
tt1000104,Patton,1993,R,136,"Family, Action",7.5,87.0,A family film set in 1993.,George Lucas,"Harrison Ford, Amy Adams, Jennifer Lawrence, Chris Hemsworth",424309,
tt1000461,Lost Revolution 354,2003,R,107,Action,7.5,72.0,A action film set in 2003.,Bong Joon-ho,"Gary Oldman, Kate Winslet, Jack Nicholson, Christian Bale",93801,409.04
tt1000353,First Revolution 246,2001,G,112,"Biography, Action",7.5,68.0,A biography film set in 2001.,Hayao Miyazaki,"Anthony Hopkins, Chris Hemsworth, Daniel Day-Lewis, Florence Pugh, Brad Pitt",1000,466.22
tt1000968,First Dreams 861,2017,PG,89,"Crime, Mystery",7.5,71.0,An epic crime tale directed by Pedro Almodóvar.,Pedro Almodóvar,"Mark Ruffalo, Tom Cruise, Brad Pitt, Gary Oldman, Meryl Streep",32071,268.63
tt1000016,Gladiator,1969,PG-13,126,"Romance, Thriller",7.5,,A thrilling romance adventure.,Kathryn Bigelow,"Scarlett Johansson, Brad Pitt, Amy Adams, Johnny Depp",58413,124.6
tt1000326,Last Kingdom 219,2003,G,88,Sci-Fi,7.5,70.0,A thrilling sci-fi adventure.,Quentin Tarantino,"Viola Davis, Tom Hanks, Matt Damon",194599,249.78
tt1000899,Final Revolution 792,2015,NC-17,93,"Family, Romance",7.4,60.0,An epic family tale directed by Guillermo del Toro.,Guillermo del Toro,"Meryl Streep, Florence Pugh, Christian Bale, Daniel Day-Lewis",439503,70.08
tt1000954,An Mission 847,2024,PG,97,Animation,7.4,84.0,A animation film set in 2024.,Edgar Wright,"Zendaya, Florence Pugh, Robert Downey Jr.",110515,236.36
tt1000004,Schindler's List,1972,PG-13,124,Drama,7.4,,An epic drama tale directed by James Cameron.,James Cameron,"Chris Hemsworth, Tom Hanks, Amy Adams, Samuel L. Jackson",2701,214.08
tt1000216,An Quest 109,2024,R,115,"Thriller, Fantasy",7.4,63.0,A critically acclaimed thriller masterpiece.,Christopher Nolan,"Anthony Hopkins, Denzel Washington, Chris Hemsworth, Tom Cruise, Meryl Streep",958796,441.1
tt1000229,Final Revolution 122,2003,PG,112,"Horror, Fantasy, Documentary",7.4,,A thrilling horror adventure.,Steven Spielberg,"Al Pacino, Amy Adams, Brad Pitt, Keanu Reeves",116587,22.84
tt1000228,Last Secrets 121,2024,PG,95,"Mystery, Comedy, Thriller",7.4,65.0,A critically acclaimed mystery masterpiece.,Peter Jackson,"Tom Hanks, Margot Robbie, Gary Oldman, Chris Hemsworth, Kate Winslet",41752,467.18
tt1000814,First Mystery 707,2002,PG,94,"Romance, Sci-Fi",7.4,69.0,A critically acclaimed romance masterpiece.,Akira Kurosawa,"Gary Oldman, Viola Davis, Leonardo DiCaprio",28156,
tt1000826,An Destiny 719,2022,NC-17,93,Fantasy,7.4,80.0,A critically acclaimed fantasy masterpiece.,Ridley Scott,"Margot Robbie, Anthony Hopkins, Daniel Day-Lewis, Tom Hanks, Keanu Reeves",24129,30.77
tt1000203,First Legend 96,2019,PG-13,149,"Action, Family",7.4,,A critically acclaimed action masterpiece.,Peter Jackson,"Harrison Ford, Jack Nicholson, Brad Pitt, Viola Davis, Scarlett Johansson",55084,485.13
tt1000893,An Mystery 786,2005,PG,114,"Comedy, Thriller",7.4,,A comedy film set in 2005.,Christopher Nolan,"Harrison Ford, Edward Norton, Viola Davis",38060,303.01
tt1000873,First Mission 766,2018,G,149,"Action, Animation, Biography",7.4,75.0,A action film set in 2018.,Wes Anderson,"Christian Bale, Al Pacino, Mark Ruffalo",195552,303.56
tt1000896,The Adventures 789,2009,PG-13,135,"Adventure, Documentary, Thriller",7.4,,A thrilling adventure adventure.,Wes Anderson,"Robert Downey Jr., Meryl Streep, Daniel Day-Lewis, Timothée Chalamet, Christian Bale",13029,236.54
tt1000905,Final Destiny 798,2001,PG,77,"Horror, Animation",7.4,72.0,An epic horror tale directed by George Lucas.,George Lucas,"Meryl Streep, Scarlett Johansson, Kate Winslet",225899,
tt1000697,A Mystery 590,2013,PG-13,126,Biography,7.4,,A critically acclaimed biography masterpiece.,Jordan Peele,"Harrison Ford, Daniel Day-Lewis, Scarlett Johansson, Viola Davis, Emma Stone",10848,
tt1000771,Dark Story 664,2005,Not Rated,129,Crime,7.4,,An epic crime tale directed by Alfred Hitchcock.,Alfred Hitchcock,"Johnny Depp, Florence Pugh, Matt Damon, Kate Winslet, Keanu Reeves",112688,314.23
tt1000759,Secret Mystery 652,2022,R,97,"Horror, Sci-Fi",7.4,61.0,A critically acclaimed horror masterpiece.,Frank Darabont,"Daniel Day-Lewis, Brad Pitt, Anthony Hopkins, Jack Nicholson",119836,439.7
tt1000702,First War 595,2002,R,101,"Documentary, Musical",7.4,82.0,A thrilling documentary adventure.,Francis Ford Coppola,"Samuel L. Jackson, Harrison Ford, Morgan Freeman, Tom Hanks",36573,25.84
tt1000746,Last Empire 639,2005,PG-13,111,Sci-Fi,7.4,75.0,A critically acclaimed sci-fi masterpiece.,Ang Lee,"Will Smith, Denzel Washington, Daniel Day-Lewis",70181,430.88
tt1000669,A Revolution 562,2000,PG-13,103,Western,7.4,,A western film set in 2000.,Stanley Kubrick,"Emma Stone, Al Pacino, Morgan Freeman, Matt Damon, Margot Robbie",244349,170.37
tt1000567,A War 460,2010,PG-13,129,Western,7.4,69.0,A western film set in 2010.,James Cameron,"Jack Nicholson, Tom Hanks, Scarlett Johansson, Denzel Washington",316332,33.07
tt1000574,A Story 467,2005,PG,134,"Biography, Horror",7.4,72.0,An epic biography tale directed by Robert Zemeckis.,Robert Zemeckis,"Zendaya, Edward Norton, Natalie Portman",14718,243.36
tt1000289,Lost Chronicles 182,2005,R,126,"Comedy, Fantasy",7.4,66.0,A critically acclaimed comedy masterpiece.,Jordan Peele,"Cate Blanchett, Margot Robbie, Scarlett Johansson, Morgan Freeman",1221153,24.24
tt1000286,Final Journey 179,2014,R,108,"Action, Adventure",7.4,75.0,An epic action tale directed by Stanley Kubrick.,Stanley Kubrick,"Chris Hemsworth, Zendaya, Gary Oldman, Leonardo DiCaprio, Mark Ruffalo",81176,469.66
tt1000298,A Quest 191,2024,PG,147,War,7.4,76.0,A war film set in 2024.,Francis Ford Coppola,"Zendaya, Kate Winslet, Viola Davis, Keanu Reeves",46598,182.83
tt1000657,Secret Legend 550,2006,PG-13,70,"Action, Western",7.4,85.0,An epic action tale directed by Francis Ford Coppola.,Francis Ford Coppola,"Mark Ruffalo, Scarlett Johansson, Zendaya, Leonardo DiCaprio",80186,273.49
tt1000637,First Legend 530,2023,PG-13,164,"Mystery, Adventure",7.4,81.0,A thrilling mystery adventure.,Spike Lee,"Keanu Reeves, Robert De Niro, Margot Robbie, Meryl Streep",126914,
tt1000633,An Dreams 526,2023,PG,114,"War, Documentary",7.4,74.0,A war film set in 2023.,Jordan Peele,"Zendaya, Robert Downey Jr., Christian Bale",36289,
tt1000654,An Adventures 547,2003,PG-13,130,Documentary,7.4,,A thrilling documentary adventure.,Robert Zemeckis,"Daniel Day-Lewis, Leonardo DiCaprio, Robert Downey Jr., Morgan Freeman",137779,217.85
tt1000280,Secret Dreams 173,2014,PG,119,Mystery,7.4,,An epic mystery tale directed by Martin Scorsese.,Martin Scorsese,"Morgan Freeman, Natalie Portman, Tom Cruise, Emma Stone",11113,
tt1000257,First Secrets 150,2019,PG,108,"Musical, Action",7.4,73.0,A thrilling musical adventure.,Ridley Scott,"Leonardo DiCaprio, Johnny Depp, Kate Winslet, Harrison Ford, Robert Downey Jr.",257514,
tt1000105,Midnight Cowboy,1981,PG,120,"Sci-Fi, Thriller, Western",7.4,80.0,A thrilling sci-fi adventure.,David Fincher,"Cate Blanchett, Brad Pitt, Meryl Streep",22556,270.63
tt1000709,Last Mission 602,2008,PG-13,142,Crime,7.4,62.0,A crime film set in 2008.,Park Chan-wook,"Leonardo DiCaprio, Tom Cruise, Scarlett Johansson, Cate Blanchett, Florence Pugh",175831,367.09
tt1000109,Lost Mission 2,1991,R,135,"Horror, Musical",7.4,72.0,A critically acclaimed horror masterpiece.,Alfred Hitchcock,"Brad Pitt, Chris Hemsworth, Kate Winslet",153663,246.13
tt1000664,Dark War 557,2008,PG-13,143,Horror,7.4,,A horror film set in 2008.,Sam Mendes,"Samuel L. Jackson, Will Smith, Denzel Washington",101434,16.37
tt1000528,The Mission 421,2001,PG-13,128,Adventure,7.4,,A critically acclaimed adventure masterpiece.,Christopher Nolan,"Edward Norton, Emma Stone, Mark Ruffalo, Samuel L. Jackson",78015,
tt1000148,Lost Mystery 41,1996,PG,93,"Family, Animation",7.4,,An epic family tale directed by Wes Anderson.,Wes Anderson,"Timothée Chalamet, Florence Pugh, Robert Downey Jr.",103766,154.02
tt1000427,Secret Quest 320,2002,NC-17,116,"Documentary, Comedy, Horror",7.4,80.0,An epic documentary tale directed by Alfred Hitchcock.,Alfred Hitchcock,"Robert De Niro, Florence Pugh, Meryl Streep",251463,50.39
tt1000312,Secret Empire 205,2020,PG-13,99,Comedy,7.4,,A comedy film set in 2020.,Taika Waititi,"Amy Adams, Edward Norton, Samuel L. Jackson, Morgan Freeman, Florence Pugh",86310,68.48
tt1000486,Last Mystery 379,2022,PG-13,145,"Documentary, Adventure",7.4,76.0,A documentary film set in 2022.,Peter Jackson,"Edward Norton, Anthony Hopkins, Tom Hanks, Jennifer Lawrence",48645,360.08
tt1000121,Secret Quest 14,1990,PG-13,128,Adventure,7.4,,A thrilling adventure adventure.,David Fincher,"Al Pacino, Brad Pitt, Edward Norton, Daniel Day-Lewis",32799,6.39
tt1000155,Final Destiny 48,1980,PG-13,115,Drama,7.4,79.0,An epic drama tale directed by Sam Mendes.,Sam Mendes,"Mark Ruffalo, Al Pacino, Chris Hemsworth, Natalie Portman, Zendaya",111907,168.75
tt1000141,First Mission 34,1987,PG-13,139,"Western, Sci-Fi, Documentary",7.4,68.0,An epic western tale directed by Hayao Miyazaki.,Hayao Miyazaki,"Mark Ruffalo, Margot Robbie, Natalie Portman, Cate Blanchett",279881,289.26
tt1000332,Lost Mission 225,2002,G,155,Adventure,7.4,81.0,A thrilling adventure adventure.,Jordan Peele,"Emma Stone, Edward Norton, Keanu Reeves",25418,
tt1000407,The Love 300,2022,NC-17,126,"Western, Drama",7.4,75.0,A thrilling western adventure.,Quentin Tarantino,"Edward Norton, Gary Oldman, Will Smith, Morgan Freeman",111379,311.08
tt1000142,An Kingdom 35,1991,PG-13,100,Adventure,7.4,,A critically acclaimed adventure masterpiece.,Jordan Peele,"Morgan Freeman, Zendaya, Mark Ruffalo, Amy Adams, Gary Oldman",292914,
tt1000144,First Mission 37,1989,PG-13,114,"Western, Thriller",7.4,,A critically acclaimed western masterpiece.,Robert Zemeckis,"Mark Ruffalo, Anthony Hopkins, Jennifer Lawrence",342049,164.65
tt1000344,The Mission 237,2000,R,127,Action,7.4,66.0,A action film set in 2000.,Coen Brothers,"Mark Ruffalo, Anthony Hopkins, Chris Hemsworth, Florence Pugh",29004,272.04
tt1000971,An Chronicles 864,2009,PG-13,135,"Fantasy, Sci-Fi",7.4,,An epic fantasy tale directed by Alfred Hitchcock.,Alfred Hitchcock,"Tom Hanks, Keanu Reeves, Chris Hemsworth, Cate Blanchett",958297,393.93
tt1000972,Secret Mission 865,2003,PG-13,116,"Romance, Sci-Fi, War",7.4,79.0,A thrilling romance adventure.,Robert Zemeckis,"Gary Oldman, Tom Hanks, Mark Ruffalo",69362,392.36
tt1000026,The Pianist,1949,PG-13,121,"Family, War, Documentary",7.4,,A family film set in 1949.,Ridley Scott,"Jennifer Lawrence, Samuel L. Jackson, Natalie Portman, Timothée Chalamet",25839,
tt1000012,Saving Private Ryan,1942,NC-17,124,"Musical, Adventure",7.4,79.0,A critically acclaimed musical masterpiece.,Kathryn Bigelow,"Leonardo DiCaprio, Chris Hemsworth, Jack Nicholson",4899,
tt1000582,Final Chronicles 475,2007,PG-13,139,"Fantasy, War",7.3,,A thrilling fantasy adventure.,Stanley Kubrick,"Anthony Hopkins, Jack Nicholson, Will Smith",79568,79.4
tt1000379,Final Journey 272,2015,R,95,Biography,7.3,71.0,An epic biography tale directed by Danny Boyle.,Danny Boyle,"Jennifer Lawrence, Johnny Depp, Tom Cruise, Gary Oldman",171400,257.46
tt1000389,Last Journey 282,2014,PG,131,"Biography, Thriller, War",7.3,69.0,A critically acclaimed biography masterpiece.,Taika Waititi,"Robert Downey Jr., Meryl Streep, Tom Cruise, Johnny Depp, Morgan Freeman",215372,375.78
tt1000295,Dark Journey 188,2000,PG-13,156,"Drama, Western",7.3,80.0,A drama film set in 2000.,Ridley Scott,"Daniel Day-Lewis, Matt Damon, Florence Pugh, Emma Stone, Leonardo DiCaprio",34928,94.93
tt1000261,Lost Story 154,2004,PG,132,Drama,7.3,83.0,A drama film set in 2004.,Steven Spielberg,"Viola Davis, Edward Norton, Brad Pitt",302903,437.64
tt1000573,A Empire 466,2016,PG,111,War,7.3,,A war film set in 2016.,Greta Gerwig,"Jack Nicholson, Johnny Depp, Emma Stone, Morgan Freeman, Jennifer Lawrence",40565,206.1
tt1000662,The Legend 555,2022,R,134,"Family, War",7.3,75.0,A thrilling family adventure.,Denis Villeneuve,"Florence Pugh, Emma Stone, Zendaya",22874,
tt1000136,Lost Kingdom 29,2000,G,122,Family,7.3,59.0,A critically acclaimed family masterpiece.,Stanley Kubrick,"Chris Hemsworth, Keanu Reeves, Mark Ruffalo, Natalie Portman, Emma Stone",174106,124.01
tt1000833,Dark Mission 726,2005,PG,126,"War, Biography",7.3,87.0,A critically acclaimed war masterpiece.,Danny Boyle,"Tom Hanks, Chris Hemsworth, Meryl Streep, Morgan Freeman, Johnny Depp",255832,190.34
tt1000842,Last Love 735,2014,R,128,"Drama, Documentary",7.3,64.0,A thrilling drama adventure.,Akira Kurosawa,"Robert De Niro, Chris Hemsworth, Jennifer Lawrence",1309054,350.03
tt1000837,Lost Destiny 730,2015,PG-13,130,"Action, Romance",7.3,,A critically acclaimed action masterpiece.,Taika Waititi,"Amy Adams, Harrison Ford, Christian Bale, Florence Pugh",40846,
tt1000914,Secret Story 807,2019,PG-13,120,"Musical, Family",7.3,71.0,A critically acclaimed musical masterpiece.,Robert Zemeckis,"Timothée Chalamet, Morgan Freeman, Meryl Streep, Margot Robbie, Jennifer Lawrence",1347,385.4
tt1000708,Dark Legend 601,2010,PG,120,"Adventure, Documentary, Musical",7.3,62.0,A critically acclaimed adventure masterpiece.,Edgar Wright,"Robert De Niro, Timothée Chalamet, Scarlett Johansson",10186,195.21
tt1000563,An Empire 456,2021,R,114,"Drama, Mystery",7.3,77.0,A drama film set in 2021.,Ava DuVernay,"Emma Stone, Margot Robbie, Scarlett Johansson",29367,81.07
tt1000556,Final Destiny 449,2002,PG-13,136,"Crime, Animation, Thriller",7.3,,A thrilling crime adventure.,Steven Spielberg,"Robert De Niro, Viola Davis, Natalie Portman, Gary Oldman",41839,423.87
tt1000488,Dark Empire 381,2012,PG-13,108,"Thriller, Adventure",7.3,86.0,A critically acclaimed thriller masterpiece.,Greta Gerwig,"Viola Davis, Jack Nicholson, Tom Cruise, Zendaya, Robert Downey Jr.",732967,
tt1000778,An Kingdom 671,2005,PG-13,137,"Comedy, Crime",7.3,65.0,A critically acclaimed comedy masterpiece.,Ron Howard,"Leonardo DiCaprio, Meryl Streep, Anthony Hopkins, Natalie Portman, Morgan Freeman",126880,
tt1000482,Final Kingdom 375,2006,PG,109,Action,7.3,59.0,A action film set in 2006.,James Cameron,"Chris Hemsworth, Florence Pugh, Harrison Ford, Christian Bale, Edward Norton",383626,53.03
tt1000886,A Love 779,2004,PG,123,"Western, Horror",7.3,67.0,An epic western tale directed by Bong Joon-ho.,Bong Joon-ho,"Anthony Hopkins, Will Smith, Daniel Day-Lewis",10266,
tt1000231,Lost Adventures 124,2002,R,132,"Musical, Mystery",7.3,81.0,A thrilling musical adventure.,Coen Brothers,"Daniel Day-Lewis, Meryl Streep, Anthony Hopkins, Margot Robbie",37634,477.8
tt1000769,Dark Love 662,2008,Not Rated,116,"Fantasy, Biography",7.3,,A fantasy film set in 2008.,Stanley Kubrick,"Kate Winslet, Jack Nicholson, Tom Cruise, Samuel L. Jackson",226722,100.44
tt1000522,Secret Revolution 415,2004,PG,121,"Musical, Comedy",7.3,,An epic musical tale directed by Ang Lee.,Ang Lee,"Will Smith, Johnny Depp, Al Pacino, Margot Robbie, Brad Pitt",5745,201.39
tt1000305,Secret War 198,2024,PG-13,125,"Drama, Documentary",7.3,,A drama film set in 2024.,Kathryn Bigelow,"Robert Downey Jr., Johnny Depp, Kate Winslet, Timothée Chalamet",79214,234.44
tt1000470,A Mission 363,2010,R,146,"Thriller, Biography, Sci-Fi",7.3,,A thrilling thriller adventure.,Edgar Wright,"Leonardo DiCaprio, Chris Hemsworth, Denzel Washington, Harrison Ford, Cate Blanchett",118637,
tt1000473,Final Kingdom 366,2022,R,130,Romance,7.3,,An epic romance tale directed by Edgar Wright.,Edgar Wright,"Timothée Chalamet, Johnny Depp, Natalie Portman",299168,319.23
tt1000808,A Legend 701,2006,R,89,"Documentary, Drama",7.3,,A critically acclaimed documentary masterpiece.,Clint Eastwood,"Christian Bale, Robert De Niro, Denzel Washington, Viola Davis",141221,413.99
tt1000805,A Destiny 698,2006,G,125,"Adventure, Comedy, Documentary",7.3,64.0,A critically acclaimed adventure masterpiece.,Wes Anderson,"Denzel Washington, Al Pacino, Anthony Hopkins",99796,
tt1000602,Last Secrets 495,2006,R,125,"Thriller, Crime, Action",7.3,,An epic thriller tale directed by Christopher Nolan.,Christopher Nolan,"Gary Oldman, Harrison Ford, Robert De Niro, Timothée Chalamet",5587,21.88
tt1000174,Secret Chronicles 67,1997,Not Rated,106,Animation,7.3,65.0,A animation film set in 1997.,Christopher Nolan,"Johnny Depp, Amy Adams, Edward Norton",19055,206.95
tt1000440,First Awakening 333,2004,PG-13,121,"Comedy, Family",7.3,,An epic comedy tale directed by Coen Brothers.,Coen Brothers,"Kate Winslet, Brad Pitt, Amy Adams, Will Smith, Christian Bale",53865,376.85
tt1000871,A Story 764,2022,R,119,"Musical, Drama",7.3,69.0,A thrilling musical adventure.,Ron Howard,"Robert De Niro, Kate Winslet, Tom Hanks",163163,123.14
tt1000319,Dark Empire 212,2008,R,129,Thriller,7.3,,An epic thriller tale directed by Guillermo del Toro.,Guillermo del Toro,"Cate Blanchett, Matt Damon, Zendaya, Tom Hanks, Al Pacino",117191,157.81
tt1000890,First War 783,2016,PG,106,"Action, Romance, Horror",7.3,70.0,A critically acclaimed action masterpiece.,Peter Jackson,"Scarlett Johansson, Jennifer Lawrence, Emma Stone, Johnny Depp, Jack Nicholson",88491,486.65
tt1000889,The Love 782,2008,R,95,"Mystery, Family, Sci-Fi",7.3,88.0,A thrilling mystery adventure.,George Lucas,"Will Smith, Jennifer Lawrence, Scarlett Johansson, Tom Hanks, Edward Norton",153038,278.48
tt1000887,Dark Story 780,2000,PG-13,102,Crime,7.3,59.0,A crime film set in 2000.,Peter Jackson,"Mark Ruffalo, Samuel L. Jackson, Natalie Portman, Leonardo DiCaprio",14435,
tt1000350,An Revolution 243,2013,R,107,"Adventure, Thriller, Drama",7.2,,An epic adventure tale directed by Ang Lee.,Ang Lee,"Viola Davis, Morgan Freeman, Scarlett Johansson, Natalie Portman",125623,83.13
tt1000939,First Destiny 832,2013,PG-13,127,Sci-Fi,7.2,,A critically acclaimed sci-fi masterpiece.,Ang Lee,"Christian Bale, Will Smith, Tom Cruise",3322,384.56
tt1000926,Last Dreams 819,2021,PG,118,Action,7.2,60.0,A critically acclaimed action masterpiece.,Ang Lee,"Christian Bale, Denzel Washington, Emma Stone, Tom Cruise",222298,249.57
tt1000616,Lost Revolution 509,2019,R,139,"Horror, Crime",7.2,,A critically acclaimed horror masterpiece.,Ava DuVernay,"Edward Norton, Denzel Washington, Jack Nicholson, Mark Ruffalo, Anthony Hopkins",22712,
tt1000780,Last Secrets 673,2022,PG-13,133,"Crime, Horror",7.2,57.0,A thrilling crime adventure.,Christopher Nolan,"Gary Oldman, Anthony Hopkins, Will Smith, Cate Blanchett",125245,
tt1000786,Secret Secrets 679,2014,PG,84,"Documentary, Romance, Adventure",7.2,62.0,A documentary film set in 2014.,Jordan Peele,"Morgan Freeman, Robert De Niro, Gary Oldman",12783,225.86
tt1000773,Dark Chronicles 666,2019,NC-17,97,"Family, Animation, Western",7.2,83.0,An epic family tale directed by Robert Zemeckis.,Robert Zemeckis,"Timothée Chalamet, Jennifer Lawrence, Florence Pugh",192606,
tt1000492,The Chronicles 385,2000,PG-13,117,"Documentary, Sci-Fi",7.2,,A documentary film set in 2000.,Hayao Miyazaki,"Harrison Ford, Morgan Freeman, Daniel Day-Lewis, Leonardo DiCaprio, Cate Blanchett",15815,
tt1000730,A Quest 623,2007,G,88,Biography,7.2,71.0,An epic biography tale directed by Wong Kar-wai.,Wong Kar-wai,"Anthony Hopkins, Tom Hanks, Kate Winslet",1247265,
tt1000548,First Revolution 441,2010,PG-13,98,"Adventure, Family",7.2,57.0,A adventure film set in 2010.,Edgar Wright,"Edward Norton, Robert Downey Jr., Jack Nicholson, Al Pacino",45219,96.15
tt1000765,Dark War 658,2017,R,130,"Sci-Fi, Comedy",7.2,,An epic sci-fi tale directed by Francis Ford Coppola.,Francis Ford Coppola,"Will Smith, Samuel L. Jackson, Tom Hanks, Viola Davis, Edward Norton",490116,448.96
tt1000753,A War 646,2015,Not Rated,123,"Horror, Thriller",7.2,78.0,An epic horror tale directed by Akira Kurosawa.,Akira Kurosawa,"Anthony Hopkins, Tom Cruise, Meryl Streep, Jack Nicholson, Morgan Freeman",109802,252.54
tt1000263,Lost Secrets 156,2015,PG,86,Documentary,7.2,,An epic documentary tale directed by Frank Darabont.,Frank Darabont,"Florence Pugh, Meryl Streep, Amy Adams, Morgan Freeman, Al Pacino",81759,
tt1000262,A Legend 155,2013,PG-13,136,"War, Adventure, Western",7.2,75.0,A thrilling war adventure.,Robert Zemeckis,"Anthony Hopkins, Zendaya, Scarlett Johansson, Matt Damon",53892,
tt1000677,Final Empire 570,2019,R,100,"Crime, Sci-Fi, Documentary",7.2,71.0,A thrilling crime adventure.,Quentin Tarantino,"Chris Hemsworth, Johnny Depp, Zendaya",127797,
tt1000687,A Story 580,2014,PG-13,117,"Biography, Action",7.2,61.0,A biography film set in 2014.,Sam Mendes,"Matt Damon, Al Pacino, Harrison Ford",51285,321.63
tt1000922,The Mystery 815,2013,PG-13,119,Fantasy,7.2,80.0,A thrilling fantasy adventure.,James Cameron,"Gary Oldman, Samuel L. Jackson, Viola Davis, Leonardo DiCaprio, Morgan Freeman",27594,
tt1000398,Last Quest 291,2015,PG,88,"Drama, Horror, Thriller",7.2,,An epic drama tale directed by Robert Zemeckis.,Robert Zemeckis,"Brad Pitt, Chris Hemsworth, Gary Oldman, Kate Winslet, Al Pacino",58136,320.44
tt1000130,First Secrets 23,1994,PG-13,102,Comedy,7.2,,A critically acclaimed comedy masterpiece.,Ava DuVernay,"Morgan Freeman, Daniel Day-Lewis, Emma Stone",8263,
tt1000543,Final War 436,2009,PG,137,"War, Documentary",7.2,,A critically acclaimed war masterpiece.,Clint Eastwood,"Denzel Washington, Al Pacino, Edward Norton",16822,
tt1000819,Secret Revolution 712,2015,R,124,"Musical, Mystery, Crime",7.2,69.0,A critically acclaimed musical masterpiece.,Bong Joon-ho,"Morgan Freeman, Robert Downey Jr., Denzel Washington, Cate Blanchett, Tom Cruise",121540,394.01
tt1000481,An Journey 374,2018,PG,94,"Crime, Thriller",7.2,75.0,A crime film set in 2018.,Denis Villeneuve,"Mark Ruffalo, Kate Winslet, Margot Robbie",22538,411.23
tt1000479,An Mission 372,2014,PG-13,152,Musical,7.2,,A musical film set in 2014.,Hayao Miyazaki,"Tom Hanks, Amy Adams, Will Smith",180289,68.8
tt1000463,Secret Chronicles 356,2000,R,104,"Horror, Musical, Documentary",7.2,,A critically acclaimed horror masterpiece.,Ang Lee,"Florence Pugh, Timothée Chalamet, Margot Robbie, Jennifer Lawrence",21664,158.42
tt1000895,Lost Adventures 788,2018,R,126,Crime,7.2,,A crime film set in 2018.,Sam Mendes,"Jack Nicholson, Will Smith, Robert Downey Jr., Tom Cruise",5982,29.36
tt1000913,First Secrets 806,2011,G,137,"Drama, Biography",7.2,60.0,A drama film set in 2011.,Taika Waititi,"Timothée Chalamet, Gary Oldman, Leonardo DiCaprio, Margot Robbie, Emma Stone",119962,30.56
