movie_id,title,year,certificate,runtime_minutes,genre,rating,metascore,description,director,stars,votes,gross_millions
tt1000866,Final Story 759,2023,NC-17,144,Horror,6.4,,A critically acclaimed horror masterpiece.,Ryan Coogler,"Johnny Depp, Tom Hanks, Mark Ruffalo",3587,220.6
tt1000685,Lost Kingdom 578,2013,PG-13,103,"Sci-Fi, Drama",6.4,50.0,A sci-fi film set in 2013.,Clint Eastwood,"Keanu Reeves, Emma Stone, Edward Norton",222255,197.9
tt1000676,The Revolution 569,2019,PG,124,"Fantasy, Documentary",6.4,,An epic fantasy tale directed by Ang Lee.,Ang Lee,"Daniel Day-Lewis, Tom Hanks, Christian Bale, Keanu Reeves",200924,342.49
tt1000876,Secret Mission 769,2017,PG,111,"Sci-Fi, Adventure",6.4,54.0,A sci-fi film set in 2017.,Christopher Nolan,"Christian Bale, Will Smith, Keanu Reeves, Tom Hanks",93420,
tt1000195,First Mission 88,1993,PG-13,124,Sci-Fi,6.4,74.0,A critically acclaimed sci-fi masterpiece.,Pedro Almodóvar,"Leonardo DiCaprio, Viola Davis, Amy Adams, Chris Hemsworth, Edward Norton",16734,94.55
tt1000729,An Dreams 622,2019,PG-13,114,Sci-Fi,6.4,57.0,A critically acclaimed sci-fi masterpiece.,Francis Ford Coppola,"Margot Robbie, Scarlett Johansson, Natalie Portman, Cate Blanchett",144759,
tt1000929,Secret Destiny 822,2017,PG-13,94,Biography,6.4,77.0,A biography film set in 2017.,Alfred Hitchcock,"Tom Cruise, Chris Hemsworth, Daniel Day-Lewis, Tom Hanks",78601,467.65
tt1000917,Last Empire 810,2005,PG,151,Action,6.4,,A thrilling action adventure.,Robert Zemeckis,"Al Pacino, Mark Ruffalo, Harrison Ford, Chris Hemsworth, Jack Nicholson",47750,295.29
tt1000603,Dark Love 496,2023,PG-13,137,"Musical, Documentary, Biography",6.4,,A thrilling musical adventure.,Robert Zemeckis,"Robert De Niro, Kate Winslet, Edward Norton",74621,253.13
tt1000969,A Awakening 862,2019,PG-13,97,Biography,6.4,78.0,A critically acclaimed biography masterpiece.,Steven Spielberg,"Denzel Washington, Keanu Reeves, Florence Pugh, Robert De Niro, Robert Downey Jr.",394637,
tt1000168,An Kingdom 61,1995,PG,106,"Adventure, Documentary",6.4,65.0,A adventure film set in 1995.,Ava DuVernay,"Robert De Niro, Scarlett Johansson, Anthony Hopkins, Brad Pitt",24622,249.96
tt1000629,The War 522,2004,PG,128,"Drama, Adventure, Comedy",6.4,,An epic drama tale directed by George Lucas.,George Lucas,"Edward Norton, Zendaya, Brad Pitt, Daniel Day-Lewis",58590,
tt1000511,A Chronicles 404,2009,PG-13,117,"Sci-Fi, Horror, Action",6.4,60.0,A critically acclaimed sci-fi masterpiece.,Coen Brothers,"Harrison Ford, Morgan Freeman, Leonardo DiCaprio",5474,82.59
tt1000514,Final Dreams 407,2024,PG,153,"War, Biography",6.4,,An epic war tale directed by Pedro Almodóvar.,Pedro Almodóvar,"Viola Davis, Matt Damon, Emma Stone",24262,228.57
tt1000761,Dark Empire 654,2006,PG-13,100,"Musical, Western, War",6.4,77.0,A thrilling musical adventure.,Ron Howard,"Gary Oldman, Matt Damon, Tom Cruise",119741,155.43
tt1000185,First Chronicles 78,1988,PG-13,111,Mystery,6.4,67.0,A critically acclaimed mystery masterpiece.,Akira Kurosawa,"Natalie Portman, Gary Oldman, Florence Pugh, Daniel Day-Lewis",18775,82.54
tt1000188,First Adventures 81,1983,PG-13,144,"Family, Horror",6.4,,An epic family tale directed by Danny Boyle.,Danny Boyle,"Zendaya, Cate Blanchett, Harrison Ford",1689,103.72
tt1000186,Lost Awakening 79,1984,R,127,"Thriller, Horror",6.4,64.0,A thriller film set in 1984.,Robert Zemeckis,"Anthony Hopkins, Cate Blanchett, Johnny Depp, Amy Adams",55483,
tt1000325,Secret Kingdom 218,2012,R,82,"Horror, Family",6.4,63.0,A critically acclaimed horror masterpiece.,Sam Mendes,"Amy Adams, Daniel Day-Lewis, Viola Davis, Keanu Reeves",1578,420.67
tt1000400,A Chronicles 293,2015,PG-13,122,"Biography, Crime",6.4,71.0,A critically acclaimed biography masterpiece.,Hayao Miyazaki,"Meryl Streep, Christian Bale, Harrison Ford, Robert De Niro",71929,132.94
tt1000539,Last Legend 432,2021,R,104,Fantasy,6.4,61.0,A thrilling fantasy adventure.,Robert Zemeckis,"Johnny Depp, Jack Nicholson, Robert Downey Jr.",335262,488.94
tt1000752,The Kingdom 645,2003,NC-17,137,Horror,6.4,74.0,A horror film set in 2003.,Hayao Miyazaki,"Gary Oldman, Samuel L. Jackson, Zendaya, Al Pacino",1204,
tt1000509,Secret Empire 402,2016,PG-13,150,Documentary,6.4,67.0,An epic documentary tale directed by Edgar Wright.,Edgar Wright,"Will Smith, Natalie Portman, Matt Damon, Leonardo DiCaprio",11165,
tt1000227,Final Quest 120,2013,PG,97,"Mystery, Western, Sci-Fi",6.3,77.0,An epic mystery tale directed by Ridley Scott.,Ridley Scott,"Harrison Ford, Cate Blanchett, Brad Pitt, Chris Hemsworth, Tom Cruise",124749,
tt1000688,First Adventures 581,2020,NC-17,125,"Western, Fantasy",6.3,71.0,A western film set in 2020.,George Lucas,"Emma Stone, Meryl Streep, Robert De Niro, Margot Robbie, Florence Pugh",1543,447.43
tt1000451,First Secrets 344,2001,PG,135,Comedy,6.3,,A thrilling comedy adventure.,Robert Zemeckis,"Jennifer Lawrence, Keanu Reeves, Al Pacino",1228,79.35
tt1000273,First Empire 166,2020,PG-13,141,"Adventure, Horror, Romance",6.3,,An epic adventure tale directed by Francis Ford Coppola.,Francis Ford Coppola,"Emma Stone, Will Smith, Edward Norton, Margot Robbie, Samuel L. Jackson",495846,483.91
tt1000459,An Revolution 352,2024,PG-13,140,"Comedy, Thriller",6.3,53.0,A critically acclaimed comedy masterpiece.,Ryan Coogler,"Will Smith, Natalie Portman, Daniel Day-Lewis",926356,
tt1000865,An Awakening 758,2008,NC-17,75,Thriller,6.3,67.0,A thriller film set in 2008.,Ang Lee,"Meryl Streep, Denzel Washington, Leonardo DiCaprio",82201,272.26
tt1000625,Last Love 518,2016,PG-13,147,"Documentary, Family",6.3,,An epic documentary tale directed by Spike Lee.,Spike Lee,"Robert Downey Jr., Jennifer Lawrence, Timothée Chalamet",43746,
tt1000651,A Adventures 544,2004,R,106,"Thriller, Adventure, Crime",6.3,63.0,An epic thriller tale directed by Akira Kurosawa.,Akira Kurosawa,"Jennifer Lawrence, Al Pacino, Johnny Depp, Daniel Day-Lewis, Amy Adams",470549,
tt1000967,An Empire 860,2013,PG-13,111,"Musical, Family",6.3,57.0,A musical film set in 2013.,Robert Zemeckis,"Johnny Depp, Natalie Portman, Tom Cruise, Samuel L. Jackson, Robert Downey Jr.",98151,99.87
tt1000198,Dark Mystery 91,1999,G,140,Family,6.3,48.0,An epic family tale directed by Alfred Hitchcock.,Alfred Hitchcock,"Will Smith, Brad Pitt, Kate Winslet, Leonardo DiCaprio",39942,99.59
tt1000439,Secret Revolution 332,2008,PG-13,113,Western,6.3,77.0,A critically acclaimed western masterpiece.,Sam Mendes,"Daniel Day-Lewis, Meryl Streep, Leonardo DiCaprio",45231,31.87
tt1000987,Lost Revolution 880,2014,NC-17,107,"Documentary, Adventure",6.3,54.0,An epic documentary tale directed by Francis Ford Coppola.,Francis Ford Coppola,"Christian Bale, Al Pacino, Viola Davis",12273,
tt1000208,Secret Empire 101,2003,PG-13,151,"Musical, Documentary",6.3,,A musical film set in 2003.,Clint Eastwood,"Florence Pugh, Scarlett Johansson, Robert De Niro",13569,324.46
tt1000397,A Adventures 290,2003,PG-13,93,"Fantasy, Musical",6.3,50.0,A thrilling fantasy adventure.,Hayao Miyazaki,"Morgan Freeman, Will Smith, Denzel Washington, Margot Robbie",96729,127.42
tt1000703,A Empire 596,2001,R,132,"Action, Biography, Animation",6.3,,A critically acclaimed action masterpiece.,Hayao Miyazaki,"Kate Winslet, Edward Norton, Morgan Freeman, Jack Nicholson, Johnny Depp",46901,205.21
tt1000220,The Journey 113,2011,PG-13,108,"Biography, Western",6.3,,An epic biography tale directed by Wong Kar-wai.,Wong Kar-wai,"Scarlett Johansson, Cate Blanchett, Florence Pugh",57003,21.86
tt1000114,Dark Mission 7,1980,PG,124,Drama,6.3,57.0,A critically acclaimed drama masterpiece.,Greta Gerwig,"Will Smith, Edward Norton, Anthony Hopkins, Zendaya, Emma Stone",17722,44.03
tt1000571,A Mission 464,2007,PG,136,Comedy,6.3,51.0,A thrilling comedy adventure.,Akira Kurosawa,"Natalie Portman, Leonardo DiCaprio, Emma Stone",52271,370.28
tt1000742,Lost Adventures 635,2020,PG-13,148,"Mystery, Adventure, Horror",6.3,,A mystery film set in 2020.,Akira Kurosawa,"Emma Stone, Jack Nicholson, Timothée Chalamet, Tom Cruise, Samuel L. Jackson",3641,
tt1000233,Secret Dreams 126,2024,R,116,Animation,6.3,68.0,An epic animation tale directed by Kathryn Bigelow.,Kathryn Bigelow,"Christian Bale, Edward Norton, Robert Downey Jr., Denzel Washington",288806,34.15
tt1000575,Last Chronicles 468,2016,R,141,"Action, Animation",6.3,64.0,An epic action tale directed by Ang Lee.,Ang Lee,"Robert Downey Jr., Cate Blanchett, Daniel Day-Lewis",201206,226.26
tt1000490,An Quest 383,2008,PG,143,"Fantasy, War, Western",6.3,75.0,An epic fantasy tale directed by Ryan Coogler.,Ryan Coogler,"Keanu Reeves, Robert Downey Jr., Will Smith, Edward Norton",48970,365.46
tt1000237,First Mystery 130,2006,R,118,Musical,6.3,62.0,A thrilling musical adventure.,Frank Darabont,"Viola Davis, Jennifer Lawrence, Natalie Portman",108956,385.04
tt1000412,Last Story 305,2001,PG,153,"Romance, War",6.3,67.0,A thrilling romance adventure.,Quentin Tarantino,"Denzel Washington, Robert Downey Jr., Anthony Hopkins, Daniel Day-Lewis, Jack Nicholson",140571,
tt1000790,Last Adventures 683,2004,R,116,"Fantasy, Animation, Sci-Fi",6.3,60.0,A thrilling fantasy adventure.,Ryan Coogler,"Daniel Day-Lewis, Gary Oldman, Emma Stone",76117,211.08
tt1000497,First Revolution 390,2000,PG-13,171,Animation,6.3,,A thrilling animation adventure.,Taika Waititi,"Matt Damon, Harrison Ford, Will Smith, Jack Nicholson",78970,198.71
tt1000695,Lost Love 588,2014,PG-13,95,"Adventure, Biography",6.3,65.0,An epic adventure tale directed by Danny Boyle.,Danny Boyle,"Robert Downey Jr., Mark Ruffalo, Viola Davis",47969,24.49
tt1000102,The Sting,1982,R,145,"Musical, Family",6.3,,A critically acclaimed musical masterpiece.,Clint Eastwood,"Harrison Ford, Anthony Hopkins, Matt Damon",81619,39.08
tt1000500,Secret Quest 393,2000,PG,135,Fantasy,6.3,72.0,A critically acclaimed fantasy masterpiece.,Ava DuVernay,"Leonardo DiCaprio, Edward Norton, Amy Adams, Robert Downey Jr.",17548,106.52
tt1000100,One Flew Over the Cuckoo's Nest,1985,PG,103,Mystery,6.3,49.0,A critically acclaimed mystery masterpiece.,Bong Joon-ho,"Mark Ruffalo, Harrison Ford, Samuel L. Jackson, Robert Downey Jr.",110206,133.09
tt1000156,Secret Mission 49,1996,PG,109,"Horror, Crime",6.3,,A critically acclaimed horror masterpiece.,Ron Howard,"Mark Ruffalo, Emma Stone, Robert De Niro",39633,59.28
tt1000149,Dark War 42,1999,PG-13,101,"Drama, Thriller, Biography",6.3,71.0,A thrilling drama adventure.,Coen Brothers,"Margot Robbie, Anthony Hopkins, Morgan Freeman",12224,299.01
tt1000151,Final Kingdom 44,1997,R,130,Crime,6.3,,A crime film set in 1997.,Ang Lee,"Natalie Portman, Harrison Ford, Edward Norton",18227,189.95
tt1000512,Secret Empire 405,2010,R,130,"Sci-Fi, War",6.3,48.0,A critically acclaimed sci-fi masterpiece.,Kathryn Bigelow,"Denzel Washington, Leonardo DiCaprio, Zendaya, Scarlett Johansson",10353,355.68
tt1000554,Final Dreams 447,2004,R,77,"Comedy, Animation, Drama",6.3,74.0,A critically acclaimed comedy masterpiece.,Ridley Scott,"Zendaya, Matt Damon, Jennifer Lawrence, Scarlett Johansson",418943,356.71
tt1000336,A Kingdom 229,2020,R,140,"Romance, War",6.3,,A thrilling romance adventure.,Jordan Peele,"Gary Oldman, Daniel Day-Lewis, Samuel L. Jackson",431961,
tt1000340,An Journey 233,2000,Not Rated,130,"Adventure, Action",6.3,,A critically acclaimed adventure masterpiece.,Akira Kurosawa,"Denzel Washington, Al Pacino, Margot Robbie",57726,242.04
tt1000253,An Love 146,2022,R,134,"Fantasy, Sci-Fi",6.3,50.0,A thrilling fantasy adventure.,Clint Eastwood,"Daniel Day-Lewis, Matt Damon, Timothée Chalamet, Margot Robbie",71898,
tt1000351,Last Quest 244,2008,PG-13,125,Crime,6.3,,A critically acclaimed crime masterpiece.,Kathryn Bigelow,"Cate Blanchett, Gary Oldman, Matt Damon, Johnny Depp, Tom Hanks",21863,252.14
tt1000949,A Secrets 842,2016,R,103,"Biography, Romance",6.3,61.0,A thrilling biography adventure.,Ron Howard,"Meryl Streep, Mark Ruffalo, Amy Adams, Denzel Washington",26670,167.6
tt1000953,A Adventures 846,2016,PG,123,"War, Romance",6.3,78.0,An epic war tale directed by Coen Brothers.,Coen Brothers,"Brad Pitt, Florence Pugh, Tom Cruise, Edward Norton",123724,338.05
tt1000171,First Story 64,1982,R,101,"Crime, Drama",6.3,51.0,A critically acclaimed crime masterpiece.,Christopher Nolan,"Tom Cruise, Morgan Freeman, Leonardo DiCaprio, Anthony Hopkins, Natalie Portman",111553,263.65
tt1000638,Final Kingdom 531,2016,PG,83,"Action, Drama",6.3,53.0,An epic action tale directed by Edgar Wright.,Edgar Wright,"Cate Blanchett, Samuel L. Jackson, Amy Adams",18367,422.3
tt1000930,The Legend 823,2003,PG-13,131,"Family, Documentary, Adventure",6.3,48.0,A thrilling family adventure.,George Lucas,"Johnny Depp, Tom Hanks, Margot Robbie",32225,148.58
tt1000936,Lost Mission 829,2011,G,138,"Family, Adventure",6.3,,An epic family tale directed by Alfred Hitchcock.,Alfred Hitchcock,"Tom Hanks, Will Smith, Cate Blanchett, Matt Damon, Christian Bale",50254,
tt1000385,Last War 278,2003,PG-13,140,Romance,6.2,68.0,A critically acclaimed romance masterpiece.,Christopher Nolan,"Timothée Chalamet, Jennifer Lawrence, Harrison Ford, Scarlett Johansson",1756183,328.97
tt1000611,Final Chronicles 504,2014,PG,125,"Fantasy, Romance",6.2,70.0,An epic fantasy tale directed by Sam Mendes.,Sam Mendes,"Morgan Freeman, Robert De Niro, Samuel L. Jackson, Harrison Ford",102976,31.42
tt1000973,Secret Awakening 866,2003,PG-13,145,"Western, Adventure, Crime",6.2,,An epic western tale directed by Wes Anderson.,Wes Anderson,"Scarlett Johansson, Margot Robbie, Florence Pugh, Jennifer Lawrence, Tom Cruise",183048,214.67
tt1000369,The Love 262,2022,PG-13,98,"Crime, Musical, Sci-Fi",6.2,47.0,An epic crime tale directed by Ang Lee.,Ang Lee,"Harrison Ford, Cate Blanchett, Al Pacino, Chris Hemsworth, Emma Stone",1057107,
tt1000740,Final Dreams 633,2021,PG-13,112,"Horror, Sci-Fi, Mystery",6.2,48.0,A horror film set in 2021.,Peter Jackson,"Meryl Streep, Anthony Hopkins, Denzel Washington, Cate Blanchett, Matt Damon",182825,263.28
tt1000718,Secret Journey 611,2010,R,94,"War, Drama",6.2,,A thrilling war adventure.,Sam Mendes,"Gary Oldman, Zendaya, Brad Pitt",34105,218.4
tt1000445,Lost Mission 338,2000,PG,113,"Western, Fantasy",6.2,,A critically acclaimed western masterpiece.,Spike Lee,"Florence Pugh, Meryl Streep, Robert De Niro, Natalie Portman, Gary Oldman",38036,98.29
tt1000867,Lost Mission 760,2005,PG,132,"Crime, Drama, Adventure",6.2,66.0,An epic crime tale directed by Spike Lee.,Spike Lee,"Morgan Freeman, Jack Nicholson, Jennifer Lawrence, Gary Oldman",10051,
tt1000466,A Destiny 359,2012,NC-17,144,"Biography, War",6.2,72.0,A biography film set in 2012.,Pedro Almodóvar,"Jack Nicholson, Anthony Hopkins, Robert Downey Jr., Cate Blanchett, Johnny Depp",12451,
tt1000221,A Mission 114,2002,PG-13,109,"Sci-Fi, Romance, Drama",6.2,,An epic sci-fi tale directed by James Cameron.,James Cameron,"Kate Winslet, Amy Adams, Tom Hanks, Timothée Chalamet",70238,36.72
tt1000419,Lost War 312,2004,Not Rated,128,"Biography, Action",6.2,,A critically acclaimed biography masterpiece.,Bong Joon-ho,"Robert Downey Jr., Matt Damon, Scarlett Johansson",55069,105.26
tt1000691,Secret Kingdom 584,2006,PG-13,123,"Adventure, Horror",6.2,72.0,A thrilling adventure adventure.,Martin Scorsese,"Daniel Day-Lewis, Matt Damon, Robert Downey Jr., Will Smith, Leonardo DiCaprio",37268,
tt1000405,Dark Story 298,2011,PG,144,"Crime, Drama",6.2,68.0,An epic crime tale directed by Sam Mendes.,Sam Mendes,"Will Smith, Keanu Reeves, Viola Davis",90988,251.49
tt1000247,An Secrets 140,2003,PG-13,94,Comedy,6.2,,A thrilling comedy adventure.,Steven Spielberg,"Keanu Reeves, Johnny Depp, Cate Blanchett, Timothée Chalamet",62263,28.32
tt1000324,Dark Empire 217,2015,PG,136,"Comedy, Thriller",6.2,74.0,A critically acclaimed comedy masterpiece.,Sam Mendes,"Jack Nicholson, Christian Bale, Robert De Niro, Florence Pugh, Cate Blanchett",30660,204.22
tt1000402,The Secrets 295,2010,PG-13,105,"Drama, Sci-Fi",6.2,,A thrilling drama adventure.,Christopher Nolan,"Amy Adams, Leonardo DiCaprio, Matt Damon, Gary Oldman, Mark Ruffalo",7303,235.3
tt1000741,The Adventures 634,2007,PG,116,"Musical, Biography",6.2,55.0,A thrilling musical adventure.,Ron Howard,"Kate Winslet, Natalie Portman, Emma Stone, Samuel L. Jackson",434502,168.04
tt1000772,An Quest 665,2014,NC-17,136,"Thriller, Romance",6.2,51.0,A thrilling thriller adventure.,Alfred Hitchcock,"Matt Damon, Tom Cruise, Christian Bale, Jack Nicholson",25914,29.0
tt1000743,An Quest 636,2013,Not Rated,140,Fantasy,6.2,60.0,A critically acclaimed fantasy masterpiece.,James Cameron,"Mark Ruffalo, Robert Downey Jr., Brad Pitt",196013,482.73
tt1000760,Final Story 653,2010,PG-13,85,"Action, Fantasy",6.2,72.0,An epic action tale directed by Spike Lee.,Spike Lee,"Viola Davis, Scarlett Johansson, Jennifer Lawrence",359031,
tt1000757,The War 650,2007,PG-13,110,"Comedy, Animation, Mystery",6.2,,A critically acclaimed comedy masterpiece.,Denis Villeneuve,"Cate Blanchett, Samuel L. Jackson, Viola Davis, Zendaya",63021,159.86
tt1000283,Secret Empire 176,2013,PG,109,"Animation, Mystery",6.2,55.0,A critically acclaimed animation masterpiece.,Ron Howard,"Brad Pitt, Margot Robbie, Natalie Portman, Meryl Streep, Matt Damon",26024,419.59
tt1000249,A Journey 142,2001,R,104,Western,6.2,64.0,An epic western tale directed by Alfred Hitchcock.,Alfred Hitchcock,"Chris Hemsworth, Tom Hanks, Natalie Portman, Margot Robbie, Cate Blanchett",7259,301.2
tt1000334,The Dreams 227,2011,R,121,Comedy,6.2,,A critically acclaimed comedy masterpiece.,Frank Darabont,"Robert Downey Jr., Samuel L. Jackson, Denzel Washington",170644,
tt1000471,A Empire 364,2010,R,163,"Sci-Fi, Documentary",6.2,73.0,A thrilling sci-fi adventure.,Wes Anderson,"Daniel Day-Lewis, Leonardo DiCaprio, Harrison Ford",240809,
tt1000834,Lost Revolution 727,2006,G,113,"Drama, Musical, Adventure",6.2,69.0,A thrilling drama adventure.,Stanley Kubrick,"Jennifer Lawrence, Emma Stone, Mark Ruffalo, Will Smith, Tom Hanks",11757,321.99
tt1000816,Secret Journey 709,2006,R,104,"Mystery, Musical",6.2,,An epic mystery tale directed by Robert Zemeckis.,Robert Zemeckis,"Timothée Chalamet, Cate Blanchett, Brad Pitt, Margot Robbie",15149,
tt1000830,Final Love 723,2006,PG-13,119,"Crime, Romance",6.2,73.0,A critically acclaimed crime masterpiece.,Quentin Tarantino,"Scarlett Johansson, Samuel L. Jackson, Natalie Portman, Keanu Reeves, Tom Hanks",28575,289.4
tt1000433,First Mission 326,2019,PG,126,Animation,6.2,52.0,A critically acclaimed animation masterpiece.,Wes Anderson,"Tom Cruise, Robert De Niro, Emma Stone, Denzel Washington",265153,101.48
tt1000618,A Kingdom 511,2024,PG,140,"Horror, Biography",6.2,47.0,An epic horror tale directed by Clint Eastwood.,Clint Eastwood,"Leonardo DiCaprio, Morgan Freeman, Chris Hemsworth, Margot Robbie, Samuel L. Jackson",483447,175.39
tt1000248,Last War 141,2016,R,130,"Thriller, Documentary",6.1,75.0,A thriller film set in 2016.,Ridley Scott,"Meryl Streep, Emma Stone, Anthony Hopkins",79233,170.4
tt1000681,An Mystery 574,2005,R,123,"Mystery, Documentary",6.1,55.0,An epic mystery tale directed by Sam Mendes.,Sam Mendes,"Scarlett Johansson, Brad Pitt, Viola Davis",321755,
tt1000591,A Kingdom 484,2016,PG-13,123,Thriller,6.1,,A thriller film set in 2016.,Alfred Hitchcock,"Amy Adams, Timothée Chalamet, Denzel Washington, Morgan Freeman",8266,36.63
tt1000290,A Destiny 183,2023,PG,116,"Comedy, Musical, Documentary",6.1,60.0,A thrilling comedy adventure.,Ang Lee,"Natalie Portman, Emma Stone, Matt Damon",7562,107.98
tt1000659,An Legend 552,2003,PG-13,138,"Animation, Mystery",6.1,71.0,An epic animation tale directed by Spike Lee.,Spike Lee,"Amy Adams, Natalie Portman, Christian Bale, Leonardo DiCaprio, Scarlett Johansson",110258,265.94
tt1000667,An Empire 560,2008,PG-13,117,Drama,6.1,,A thrilling drama adventure.,Jordan Peele,"Christian Bale, Florence Pugh, Tom Cruise, Leonardo DiCaprio, Daniel Day-Lewis",37724,
tt1000598,Secret Secrets 491,2002,PG-13,124,"Animation, Musical",6.1,72.0,A critically acclaimed animation masterpiece.,Denis Villeneuve,"Keanu Reeves, Tom Cruise, Samuel L. Jackson, Brad Pitt, Margot Robbie",37101,
tt1000434,Last Revolution 327,2010,PG,116,"Adventure, Thriller",6.1,72.0,An epic adventure tale directed by Danny Boyle.,Danny Boyle,"Robert De Niro, Anthony Hopkins, Natalie Portman, Brad Pitt",133888,
tt1000626,Lost Destiny 519,2011,PG-13,86,"Fantasy, Western, War",6.1,,A thrilling fantasy adventure.,Ryan Coogler,"Keanu Reeves, Robert De Niro, Florence Pugh, Amy Adams, Scarlett Johansson",254556,164.26
tt1000903,Secret Quest 796,2023,R,151,Animation,6.1,56.0,A thrilling animation adventure.,Bong Joon-ho,"Meryl Streep, Emma Stone, Mark Ruffalo, Robert Downey Jr.",596331,
tt1000909,Secret Awakening 802,2009,Not Rated,146,"Comedy, Family",6.1,60.0,An epic comedy tale directed by James Cameron.,James Cameron,"Jennifer Lawrence, Robert De Niro, Will Smith",28912,275.74
tt1000107,In the Heat of the Night,1996,PG,131,"Documentary, War",6.1,,A critically acclaimed documentary masterpiece.,Peter Jackson,"Jack Nicholson, Robert Downey Jr., Harrison Ford",1381362,262.67
tt1000138,Secret Love 31,1989,PG-13,126,Adventure,6.1,72.0,A thrilling adventure adventure.,Danny Boyle,"Samuel L. Jackson, Cate Blanchett, Morgan Freeman",368023,115.3
tt1000468,The Legend 361,2000,R,139,"Horror, Fantasy, Family",6.1,,An epic horror tale directed by James Cameron.,James Cameron,"Brad Pitt, Harrison Ford, Viola Davis, Al Pacino, Timothée Chalamet",7095,279.05
tt1000670,Last Love 563,2000,PG-13,87,Fantasy,6.1,64.0,An epic fantasy tale directed by Bong Joon-ho.,Bong Joon-ho,"Brad Pitt, Chris Hemsworth, Denzel Washington, Anthony Hopkins, Robert Downey Jr.",18888,115.49
tt1000529,An Secrets 422,2013,PG-13,112,Comedy,6.1,,A comedy film set in 2013.,Ridley Scott,"Natalie Portman, Daniel Day-Lewis, Denzel Washington, Scarlett Johansson, Matt Damon",68132,
tt1000920,The Love 813,2022,PG,132,"Drama, Musical",6.1,,A drama film set in 2022.,Ridley Scott,"Keanu Reeves, Jennifer Lawrence, Gary Oldman",229356,
tt1000391,Secret Mission 284,2001,PG-13,118,"Mystery, Animation",6.1,69.0,A thrilling mystery adventure.,Ridley Scott,"Keanu Reeves, Emma Stone, Kate Winslet",39300,290.8
tt1000411,The Empire 304,2024,PG-13,171,Western,6.1,,A western film set in 2024.,Stanley Kubrick,"Meryl Streep, Anthony Hopkins, Margot Robbie",699887,224.88
tt1000491,An Mystery 384,2002,PG-13,120,"Mystery, Comedy",6.1,,A thrilling mystery adventure.,Francis Ford Coppola,"Jennifer Lawrence, Al Pacino, Christian Bale, Denzel Washington, Robert Downey Jr.",158327,
tt1000161,Final Mystery 54,1997,PG,124,"Fantasy, Romance",6.1,,An epic fantasy tale directed by Hayao Miyazaki.,Hayao Miyazaki,"Al Pacino, Daniel Day-Lewis, Florence Pugh, Keanu Reeves, Leonardo DiCaprio",7091,233.68
tt1000520,Final Dreams 413,2007,PG-13,119,"Mystery, Thriller",6.1,67.0,A critically acclaimed mystery masterpiece.,Stanley Kubrick,"Johnny Depp, Matt Damon, Edward Norton",1577,478.37
tt1000534,A Legend 427,2001,R,107,"Comedy, Fantasy",6.1,57.0,An epic comedy tale directed by Peter Jackson.,Peter Jackson,"Christian Bale, Keanu Reeves, Tom Cruise, Timothée Chalamet, Kate Winslet",29024,84.25
tt1000126,Secret Quest 19,1988,PG-13,163,"Drama, Romance",6.1,71.0,A drama film set in 1988.,Alfred Hitchcock,"Tom Cruise, Will Smith, Brad Pitt, Gary Oldman, Jack Nicholson",10194,50.17
tt1000526,Lost Kingdom 419,2022,PG,105,"War, Biography",6.1,53.0,A critically acclaimed war masterpiece.,Alfred Hitchcock,"Robert De Niro, Amy Adams, Christian Bale, Tom Hanks, Johnny Depp",80890,369.21
tt1000113,The Mystery 6,1988,PG-13,108,"Romance, Drama",6.1,,A romance film set in 1988.,David Fincher,"Natalie Portman, Scarlett Johansson, Will Smith, Gary Oldman, Keanu Reeves",51777,
tt1000764,Lost War 657,2020,PG-13,121,"Fantasy, Western, Horror",6.1,60.0,An epic fantasy tale directed by Quentin Tarantino.,Quentin Tarantino,"Kate Winslet, Viola Davis, Edward Norton, Robert De Niro",17228,
tt1000285,An Chronicles 178,2000,PG,108,Drama,6.1,62.0,An epic drama tale directed by Stanley Kubrick.,Stanley Kubrick,"Robert Downey Jr., Gary Oldman, Amy Adams, Brad Pitt, Natalie Portman",121433,
tt1000666,Lost Dreams 559,2005,R,116,War,6.1,,A war film set in 2005.,James Cameron,"Kate Winslet, Denzel Washington, Margot Robbie",21747,
tt1000977,An Secrets 870,2018,PG-13,110,"Documentary, Horror",6.0,72.0,A documentary film set in 2018.,Martin Scorsese,"Christian Bale, Amy Adams, Scarlett Johansson",250935,
tt1000581,Dark Awakening 474,2017,PG-13,143,"Drama, Biography",6.0,,An epic drama tale directed by Ava DuVernay.,Ava DuVernay,"Amy Adams, Morgan Freeman, Will Smith, Tom Cruise, Tom Hanks",85609,248.38
tt1000588,Last Quest 481,2006,PG,115,Romance,6.0,59.0,A romance film set in 2006.,Ron Howard,"Emma Stone, Harrison Ford, Matt Damon, Anthony Hopkins, Edward Norton",1554110,213.99
tt1000456,First Legend 349,2003,Not Rated,111,War,6.0,46.0,An epic war tale directed by Ryan Coogler.,Ryan Coogler,"Viola Davis, Florence Pugh, Denzel Washington, Anthony Hopkins, Edward Norton",46192,287.15
tt1000196,Dark Journey 89,1980,PG,136,"War, Animation, Fantasy",6.0,70.0,An epic war tale directed by Edgar Wright.,Edgar Wright,"Scarlett Johansson, Samuel L. Jackson, Al Pacino, Edward Norton",39995,60.63
tt1000804,A War 697,2007,R,97,"Drama, Family, Mystery",6.0,49.0,A drama film set in 2007.,Francis Ford Coppola,"Emma Stone, Timothée Chalamet, Jack Nicholson",275541,
tt1000844,First Story 737,2013,PG-13,131,"Drama, Romance",6.0,,A drama film set in 2013.,Taika Waititi,"Chris Hemsworth, Edward Norton, Amy Adams",32014,
tt1000517,Secret Story 410,2008,Not Rated,115,Drama,6.0,,A thrilling drama adventure.,Alfred Hitchcock,"Timothée Chalamet, Al Pacino, Cate Blanchett, Brad Pitt, Amy Adams",17321,317.42
tt1000883,The Destiny 776,2020,PG-13,138,Romance,6.0,61.0,An epic romance tale directed by Hayao Miyazaki.,Hayao Miyazaki,"Amy Adams, Meryl Streep, Robert De Niro, Zendaya, Timothée Chalamet",584741,
