movie_id,title,year,certificate,runtime_minutes,genre,rating,metascore,description,director,stars,votes,gross_millions
tt1000736,Final Story 629,2008,R,113,Drama,6.8,53.0,An epic drama tale directed by Martin Scorsese.,Martin Scorsese,"Johnny Depp, Gary Oldman, Meryl Streep, Harrison Ford, Anthony Hopkins",9176,23.95
tt1000146,Dark Dreams 39,1986,R,85,"Adventure, Family",6.8,71.0,A critically acclaimed adventure masterpiece.,James Cameron,"Meryl Streep, Edward Norton, Will Smith, Mark Ruffalo",63912,57.34
tt1000852,The Destiny 745,2021,PG,70,"Sci-Fi, Thriller, Drama",6.8,68.0,A critically acclaimed sci-fi masterpiece.,Ron Howard,"Cate Blanchett, Kate Winslet, Harrison Ford",97902,206.65
tt1000169,The Quest 62,1996,NC-17,102,"Adventure, Musical",6.8,,A adventure film set in 1996.,Martin Scorsese,"Keanu Reeves, Morgan Freeman, Al Pacino, Amy Adams, Brad Pitt",17215,248.82
tt1000364,First Kingdom 257,2004,PG,134,"Documentary, Comedy",6.8,,An epic documentary tale directed by Ang Lee.,Ang Lee,"Amy Adams, Chris Hemsworth, Johnny Depp",179684,
tt1000453,Lost Mission 346,2014,G,123,"Sci-Fi, Musical",6.8,67.0,An epic sci-fi tale directed by Edgar Wright.,Edgar Wright,"Al Pacino, Chris Hemsworth, Harrison Ford, Johnny Depp",142762,308.6
tt1000846,An Quest 739,2024,PG,95,"Family, Comedy",6.8,70.0,A family film set in 2024.,Alfred Hitchcock,"Anthony Hopkins, Timothée Chalamet, Jennifer Lawrence, Amy Adams",20653,
tt1000455,Lost Journey 348,2023,Not Rated,116,"War, Animation",6.8,,A war film set in 2023.,Taika Waititi,"Viola Davis, Chris Hemsworth, Robert De Niro, Gary Oldman",14766,
tt1000134,A Mission 27,1997,PG-13,120,"Drama, Adventure",6.8,61.0,An epic drama tale directed by Pedro Almodóvar.,Pedro Almodóvar,"Christian Bale, Robert De Niro, Viola Davis, Margot Robbie",30482,
tt1000178,A Love 71,1988,PG,106,"Animation, Drama",6.8,,A critically acclaimed animation masterpiece.,Danny Boyle,"Jack Nicholson, Mark Ruffalo, Robert De Niro, Keanu Reeves, Robert Downey Jr.",9882,289.1
tt1000829,Last Dreams 722,2012,R,119,Documentary,6.8,,A documentary film set in 2012.,Guillermo del Toro,"Morgan Freeman, Meryl Streep, Anthony Hopkins",3362,149.84
tt1000415,Final Chronicles 308,2013,PG,95,"Family, Sci-Fi",6.8,69.0,An epic family tale directed by Greta Gerwig.,Greta Gerwig,"Timothée Chalamet, Robert Downey Jr., Florence Pugh, Leonardo DiCaprio, Tom Cruise",18864,329.34
tt1000908,Last Revolution 801,2000,R,159,"Adventure, Romance",6.8,82.0,A critically acclaimed adventure masterpiece.,Danny Boyle,"Edward Norton, Natalie Portman, Christian Bale",272991,279.67
tt1000822,A Secrets 715,2000,PG-13,104,"Biography, Sci-Fi",6.8,77.0,A critically acclaimed biography masterpiece.,Edgar Wright,"Tom Hanks, Edward Norton, Margot Robbie, Daniel Day-Lewis, Matt Damon",166873,260.98
tt1000897,The War 790,2011,R,115,"Animation, War",6.8,,An epic animation tale directed by Coen Brothers.,Coen Brothers,"Margot Robbie, Natalie Portman, Jennifer Lawrence, Emma Stone",48935,
tt1000902,Secret Dreams 795,2013,PG-13,122,"Mystery, Biography",6.8,,A critically acclaimed mystery masterpiece.,Alfred Hitchcock,"Keanu Reeves, Cate Blanchett, Natalie Portman, Johnny Depp",35343,14.52
tt1000163,Last Awakening 56,1991,PG-13,137,"Biography, Animation",6.8,,A critically acclaimed biography masterpiece.,Park Chan-wook,"Meryl Streep, Margot Robbie, Jack Nicholson",551234,202.23
tt1000170,First Chronicles 63,2000,NC-17,125,"Documentary, War, Fantasy",6.8,60.0,A critically acclaimed documentary masterpiece.,Pedro Almodóvar,"Zendaya, Jack Nicholson, Edward Norton, Brad Pitt",41838,129.1
tt1000630,Dark Mystery 523,2003,PG,130,"Thriller, Action",6.8,,A thrilling thriller adventure.,Ryan Coogler,"Gary Oldman, Kate Winslet, Edward Norton, Robert Downey Jr.",31114,414.11
tt1000435,Last Journey 328,2022,PG-13,102,"Romance, Crime",6.8,,A romance film set in 2022.,Park Chan-wook,"Cate Blanchett, Leonardo DiCaprio, Johnny Depp, Kate Winslet",59060,87.8
tt1000101,The Godfather Part II,1992,G,132,Biography,6.8,62.0,An epic biography tale directed by Stanley Kubrick.,Stanley Kubrick,"Amy Adams, Cate Blanchett, Jack Nicholson, Tom Hanks",71395,252.76
tt1000732,Last Kingdom 625,2010,PG-13,128,Documentary,6.8,80.0,A thrilling documentary adventure.,Clint Eastwood,"Morgan Freeman, Emma Stone, Tom Hanks, Leonardo DiCaprio, Anthony Hopkins",22874,113.06
tt1000710,A Love 603,2010,PG-13,128,"Family, Comedy, Action",6.8,75.0,An epic family tale directed by George Lucas.,George Lucas,"Jennifer Lawrence, Samuel L. Jackson, Matt Damon",164274,143.02
tt1000122,An Adventures 15,1992,R,124,"Drama, Mystery",6.8,,An epic drama tale directed by George Lucas.,George Lucas,"Tom Hanks, Leonardo DiCaprio, Jennifer Lawrence",69321,162.47
tt1000513,Last Secrets 406,2017,R,70,"Thriller, Animation, Horror",6.8,73.0,A critically acclaimed thriller masterpiece.,Robert Zemeckis,"Kate Winslet, Scarlett Johansson, Margot Robbie",854590,435.31
tt1000745,A Journey 638,2011,G,134,"Documentary, Family",6.8,74.0,A critically acclaimed documentary masterpiece.,Frank Darabont,"Harrison Ford, Scarlett Johansson, Tom Cruise, Christian Bale",14315,392.17
tt1000726,Secret Secrets 619,2002,R,160,"Crime, Comedy",6.8,71.0,A crime film set in 2002.,Ang Lee,"Emma Stone, Kate Winslet, Johnny Depp, Timothée Chalamet",45023,239.54
tt1000177,Last Journey 70,1991,R,86,Drama,6.7,,A critically acclaimed drama masterpiece.,Francis Ford Coppola,"Mark Ruffalo, Robert Downey Jr., Zendaya",9734,124.61
tt1000817,Secret Secrets 710,2019,PG-13,103,"Musical, Drama",6.7,80.0,A thrilling musical adventure.,Alfred Hitchcock,"Johnny Depp, Margot Robbie, Al Pacino, Tom Cruise",20462,411.63
tt1000946,Last Chronicles 839,2016,PG-13,164,Comedy,6.7,78.0,A comedy film set in 2016.,Peter Jackson,"Harrison Ford, Amy Adams, Robert Downey Jr., Viola Davis, Tom Cruise",93287,378.74
tt1000995,Secret War 888,2007,PG,100,"Animation, Musical",6.7,,A animation film set in 2007.,Denis Villeneuve,"Kate Winslet, Will Smith, Anthony Hopkins",68875,
tt1000942,Last Adventures 835,2017,PG-13,144,"Fantasy, Action",6.7,69.0,A fantasy film set in 2017.,Frank Darabont,"Jennifer Lawrence, Harrison Ford, Mark Ruffalo",249489,
tt1000314,Secret Story 207,2002,PG-13,133,Thriller,6.7,,A critically acclaimed thriller masterpiece.,David Fincher,"Margot Robbie, Chris Hemsworth, Will Smith, Florence Pugh, Jack Nicholson",955466,385.56
tt1000631,Last Secrets 524,2023,R,117,"Documentary, Comedy, Sci-Fi",6.7,,A critically acclaimed documentary masterpiece.,Taika Waititi,"Emma Stone, Anthony Hopkins, Margot Robbie, Kate Winslet, Matt Damon",34371,385.32
tt1000975,Lost Adventures 868,2011,PG-13,125,"Comedy, Animation",6.7,,A thrilling comedy adventure.,Ryan Coogler,"Robert De Niro, Natalie Portman, Leonardo DiCaprio, Mark Ruffalo",82625,81.84
tt1000974,Lost Mystery 867,2017,Not Rated,116,"Romance, Drama, Biography",6.7,76.0,An epic romance tale directed by James Cameron.,James Cameron,"Edward Norton, Timothée Chalamet, Tom Hanks",68708,
tt1000600,Final Quest 493,2012,PG-13,158,"Comedy, Action",6.7,,A comedy film set in 2012.,James Cameron,"Robert De Niro, Kate Winslet, Florence Pugh",20689,
tt1000585,Dark Revolution 478,2002,PG,147,Action,6.7,78.0,A thrilling action adventure.,James Cameron,"Viola Davis, Chris Hemsworth, Leonardo DiCaprio",250023,
tt1000254,A Mission 147,2015,PG-13,171,"Romance, Biography, Sci-Fi",6.7,65.0,A thrilling romance adventure.,Sam Mendes,"Jack Nicholson, Margot Robbie, Mark Ruffalo, Robert De Niro, Chris Hemsworth",335678,244.54
tt1000570,First Dreams 463,2003,PG-13,142,"Musical, Horror",6.7,78.0,A musical film set in 2003.,Pedro Almodóvar,"Al Pacino, Samuel L. Jackson, Robert Downey Jr.",2300,127.86
tt1000609,An Mystery 502,2006,PG,148,"Drama, Musical",6.7,,A drama film set in 2006.,Edgar Wright,"Brad Pitt, Edward Norton, Mark Ruffalo, Morgan Freeman, Kate Winslet",61591,431.54
tt1000935,Final War 828,2017,R,84,"Musical, Crime",6.7,74.0,A critically acclaimed musical masterpiece.,Ava DuVernay,"Al Pacino, Keanu Reeves, Scarlett Johansson",17161,381.09
tt1000990,A Dreams 883,2001,PG-13,81,Animation,6.7,78.0,An epic animation tale directed by Peter Jackson.,Peter Jackson,"Florence Pugh, Leonardo DiCaprio, Anthony Hopkins",7688,469.72
tt1000613,First Love 506,2013,PG,115,"Horror, Comedy",6.7,,A critically acclaimed horror masterpiece.,Ridley Scott,"Scarlett Johansson, Chris Hemsworth, Mark Ruffalo, Natalie Portman, Morgan Freeman",3558,
tt1000698,A Mystery 591,2014,R,140,"Drama, Mystery",6.7,71.0,An epic drama tale directed by Denis Villeneuve.,Denis Villeneuve,"Jack Nicholson, Anthony Hopkins, Gary Oldman, Cate Blanchett, Tom Hanks",163688,437.94
tt1000597,Dark Destiny 490,2016,PG,122,"Documentary, Comedy",6.7,,A critically acclaimed documentary masterpiece.,Peter Jackson,"Timothée Chalamet, Emma Stone, Brad Pitt, Will Smith",163899,452.25
tt1000392,A Dreams 285,2010,NC-17,86,"Animation, Fantasy",6.7,77.0,A animation film set in 2010.,Ava DuVernay,"Meryl Streep, Kate Winslet, Will Smith, Al Pacino, Christian Bale",13590,316.14
tt1000259,First Secrets 152,2001,R,115,Family,6.7,,A thrilling family adventure.,Ryan Coogler,"Robert Downey Jr., Tom Hanks, Jennifer Lawrence",151904,278.95
tt1000569,Secret Revolution 462,2002,R,157,"Animation, Horror",6.7,73.0,A thrilling animation adventure.,Ridley Scott,"Emma Stone, Morgan Freeman, Brad Pitt, Margot Robbie, Johnny Depp",13880,347.08
tt1000547,An Kingdom 440,2021,PG-13,148,"Drama, Romance, Documentary",6.7,76.0,A thrilling drama adventure.,James Cameron,"Viola Davis, Emma Stone, Gary Oldman, Zendaya, Harrison Ford",118013,17.04
tt1000408,First Empire 301,2024,PG-13,116,War,6.7,,A war film set in 2024.,Jordan Peele,"Daniel Day-Lewis, Cate Blanchett, Timothée Chalamet",63941,363.4
tt1000756,A Destiny 649,2020,PG-13,109,Family,6.7,75.0,A critically acclaimed family masterpiece.,Sam Mendes,"Matt Damon, Viola Davis, Al Pacino, Timothée Chalamet",100862,398.88
tt1000372,Last Mission 265,2017,PG-13,168,"Musical, Thriller",6.7,66.0,An epic musical tale directed by Ryan Coogler.,Ryan Coogler,"Edward Norton, Tom Hanks, Christian Bale, Robert Downey Jr.",80954,447.51
tt1000106,Oliver!,1993,PG-13,126,Horror,6.7,,A critically acclaimed horror masterpiece.,Francis Ford Coppola,"Anthony Hopkins, Mark Ruffalo, Daniel Day-Lewis",69251,247.66
tt1000442,First War 335,2021,PG-13,101,Documentary,6.7,,A documentary film set in 2021.,Alfred Hitchcock,"Chris Hemsworth, Kate Winslet, Denzel Washington, Leonardo DiCaprio",9754,226.61
tt1000321,Lost Destiny 214,2005,NC-17,134,"Thriller, Crime",6.7,68.0,A thrilling thriller adventure.,Pedro Almodóvar,"Matt Damon, Kate Winslet, Jack Nicholson, Zendaya",519268,
tt1000363,Final War 256,2013,PG-13,116,"Adventure, War",6.7,74.0,An epic adventure tale directed by Stanley Kubrick.,Stanley Kubrick,"Keanu Reeves, Timothée Chalamet, Emma Stone",56622,217.04
tt1000644,Dark Kingdom 537,2017,Not Rated,110,"Mystery, Sci-Fi, Drama",6.7,,A mystery film set in 2017.,Steven Spielberg,"Al Pacino, Timothée Chalamet, Zendaya, Mark Ruffalo",2500000,316.39
tt1000639,Secret Empire 532,2023,R,107,"Comedy, Documentary",6.6,,An epic comedy tale directed by Guillermo del Toro.,Guillermo del Toro,"Edward Norton, Robert De Niro, Viola Davis",29491,74.58
tt1000952,First Mission 845,2007,PG-13,105,"Documentary, Comedy",6.6,,A critically acclaimed documentary masterpiece.,Coen Brothers,"Robert De Niro, Johnny Depp, Daniel Day-Lewis",351367,195.26
tt1000607,Lost Kingdom 500,2010,PG-13,121,"Action, Fantasy",6.6,,A thrilling action adventure.,Ron Howard,"Meryl Streep, Zendaya, Robert De Niro, Gary Oldman, Al Pacino",22583,
tt1000944,Dark Story 837,2013,PG,151,"Mystery, Western",6.6,74.0,A critically acclaimed mystery masterpiece.,Spike Lee,"Tom Hanks, Meryl Streep, Leonardo DiCaprio, Al Pacino",41561,
tt1000868,Lost Story 761,2005,PG,107,"Horror, Thriller, Drama",6.6,,A horror film set in 2005.,Greta Gerwig,"Anthony Hopkins, Kate Winslet, Natalie Portman, Scarlett Johansson",24170,
tt1000182,Last Mystery 75,1999,R,131,Comedy,6.6,79.0,A critically acclaimed comedy masterpiece.,Akira Kurosawa,"Leonardo DiCaprio, Harrison Ford, Meryl Streep, Amy Adams, Florence Pugh",104476,234.79
tt1000343,First Kingdom 236,2018,PG-13,99,"Thriller, Mystery",6.6,,A critically acclaimed thriller masterpiece.,Pedro Almodóvar,"Jennifer Lawrence, Will Smith, Johnny Depp, Florence Pugh, Amy Adams",4900,271.4
tt1000856,Dark Journey 749,2020,R,137,Action,6.6,77.0,A thrilling action adventure.,Martin Scorsese,"Daniel Day-Lewis, Tom Hanks, Cate Blanchett, Florence Pugh",63408,120.42
tt1000487,Dark Quest 380,2003,NC-17,95,"Comedy, Biography",6.6,58.0,A comedy film set in 2003.,Spike Lee,"Scarlett Johansson, Will Smith, Leonardo DiCaprio",16717,209.32
tt1000329,A Secrets 222,2021,PG-13,137,"Adventure, Musical",6.6,78.0,A thrilling adventure adventure.,Greta Gerwig,"Anthony Hopkins, Viola Davis, Morgan Freeman, Mark Ruffalo, Harrison Ford",62338,
tt1000217,Last Mission 110,2010,Not Rated,142,Animation,6.6,53.0,An epic animation tale directed by Ron Howard.,Ron Howard,"Al Pacino, Scarlett Johansson, Edward Norton, Robert Downey Jr., Daniel Day-Lewis",11386,118.19
tt1000825,The War 718,2022,R,134,"Western, Adventure, Thriller",6.6,77.0,A western film set in 2022.,Clint Eastwood,"Jennifer Lawrence, Denzel Washington, Mark Ruffalo",529607,413.19
tt1000476,The Story 369,2022,PG,115,"Western, Musical",6.6,,A critically acclaimed western masterpiece.,Peter Jackson,"Natalie Portman, Cate Blanchett, Leonardo DiCaprio",94950,330.77
tt1000807,An War 700,2008,PG,143,"Thriller, Comedy, Crime",6.6,60.0,A thrilling thriller adventure.,Jordan Peele,"Christian Bale, Daniel Day-Lewis, Robert Downey Jr.",56094,275.58
tt1000795,A Awakening 688,2010,PG-13,104,"Sci-Fi, Crime",6.6,54.0,An epic sci-fi tale directed by Francis Ford Coppola.,Francis Ford Coppola,"Margot Robbie, Kate Winslet, Amy Adams, Timothée Chalamet",14967,
tt1000862,Last Journey 755,2009,R,93,"Mystery, Adventure",6.6,55.0,A thrilling mystery adventure.,Akira Kurosawa,"Jennifer Lawrence, Daniel Day-Lewis, Amy Adams, Will Smith",18032,110.81
tt1000880,First Awakening 773,2003,PG-13,156,"Biography, Drama",6.6,,A thrilling biography adventure.,Bong Joon-ho,"Natalie Portman, Edward Norton, Johnny Depp",16790,212.08
tt1000458,The Secrets 351,2012,PG,149,"Documentary, Crime, War",6.6,,A critically acclaimed documentary masterpiece.,Ang Lee,"Chris Hemsworth, Keanu Reeves, Harrison Ford, Anthony Hopkins",21947,297.22
tt1000847,Last Awakening 740,2024,G,94,"War, Thriller",6.6,69.0,A thrilling war adventure.,Ridley Scott,"Tom Hanks, Keanu Reeves, Kate Winslet, Robert De Niro, Matt Damon",37694,
tt1000839,Final Chronicles 732,2002,PG-13,75,"Biography, Western",6.6,77.0,A critically acclaimed biography masterpiece.,Frank Darabont,"Christian Bale, Meryl Streep, Timothée Chalamet, Keanu Reeves, Johnny Depp",16695,443.54
tt1000727,Secret Mystery 620,2010,PG-13,112,"War, Drama",6.6,55.0,An epic war tale directed by Kathryn Bigelow.,Kathryn Bigelow,"Anthony Hopkins, Tom Hanks, Leonardo DiCaprio",469429,392.75
tt1000116,First Adventures 9,2000,PG,105,"Romance, Crime",6.6,,A romance film set in 2000.,Coen Brothers,"Daniel Day-Lewis, Margot Robbie, Brad Pitt",95450,86.68
tt1000501,The Mystery 394,2013,R,119,"Fantasy, Horror",6.6,78.0,An epic fantasy tale directed by Clint Eastwood.,Clint Eastwood,"Jennifer Lawrence, Edward Norton, Cate Blanchett, Amy Adams, Jack Nicholson",30338,84.72
tt1000507,Final Revolution 400,2024,PG-13,131,Crime,6.6,67.0,A crime film set in 2024.,Clint Eastwood,"Zendaya, Florence Pugh, Kate Winslet, Morgan Freeman, Edward Norton",14197,363.18
tt1000568,First Destiny 461,2022,PG,128,Comedy,6.6,,A comedy film set in 2022.,Taika Waititi,"Leonardo DiCaprio, Denzel Washington, Samuel L. Jackson, Meryl Streep, Morgan Freeman",164203,
tt1000705,The Secrets 598,2022,PG-13,109,"Fantasy, Horror",6.6,60.0,An epic fantasy tale directed by Wong Kar-wai.,Wong Kar-wai,"Kate Winslet, Samuel L. Jackson, Will Smith, Meryl Streep",13473,450.61
tt1000706,Lost Love 599,2000,NC-17,70,"Romance, Family",6.6,60.0,An epic romance tale directed by David Fincher.,David Fincher,"Chris Hemsworth, Amy Adams, Kate Winslet, Robert Downey Jr., Johnny Depp",2233148,114.4
tt1000916,Lost Secrets 809,2009,R,127,Adventure,6.6,,A critically acclaimed adventure masterpiece.,Ridley Scott,"Jack Nicholson, Florence Pugh, Morgan Freeman, Samuel L. Jackson, Timothée Chalamet",833353,22.81
tt1000536,First Quest 429,2009,PG,126,"Comedy, Musical",6.6,62.0,A critically acclaimed comedy masterpiece.,Jordan Peele,"Robert Downey Jr., Christian Bale, Robert De Niro",38649,484.78
tt1000533,A Kingdom 426,2023,R,105,"Mystery, War",6.6,78.0,A thrilling mystery adventure.,Hayao Miyazaki,"Keanu Reeves, Johnny Depp, Tom Hanks",470859,73.46
tt1000158,Last Mystery 51,1999,R,152,Biography,6.6,,An epic biography tale directed by Ang Lee.,Ang Lee,"Leonardo DiCaprio, Margot Robbie, Jennifer Lawrence",142178,209.57
tt1000103,The French Connection,1991,R,115,"Horror, Fantasy",6.6,,A critically acclaimed horror masterpiece.,Ron Howard,"Johnny Depp, Jack Nicholson, Al Pacino",311191,18.16
tt1000749,First Love 642,2003,PG-13,93,"Sci-Fi, Crime",6.6,,A sci-fi film set in 2003.,Spike Lee,"Leonardo DiCaprio, Morgan Freeman, Tom Cruise, Chris Hemsworth",238583,
tt1000762,Final Awakening 655,2012,PG-13,135,"Biography, Horror",6.6,,A biography film set in 2012.,Taika Waititi,"Margot Robbie, Harrison Ford, Zendaya",24434,
tt1000655,A Adventures 548,2023,PG-13,121,"Documentary, Mystery",6.6,59.0,A critically acclaimed documentary masterpiece.,Taika Waititi,"Christian Bale, Johnny Depp, Robert Downey Jr., Tom Cruise, Natalie Portman",47719,
tt1000580,Final Legend 473,2000,R,117,"Documentary, Family, Adventure",6.6,,A thrilling documentary adventure.,Alfred Hitchcock,"Chris Hemsworth, Timothée Chalamet, Kate Winslet",66508,297.17
tt1000381,An Kingdom 274,2005,NC-17,122,Sci-Fi,6.6,,A critically acclaimed sci-fi masterpiece.,Quentin Tarantino,"Tom Cruise, Robert Downey Jr., Gary Oldman, Daniel Day-Lewis, Mark Ruffalo",61289,202.7
tt1000923,Final Love 816,2008,R,116,"Thriller, Fantasy, Sci-Fi",6.6,,An epic thriller tale directed by Wes Anderson.,Wes Anderson,"Meryl Streep, Robert De Niro, Daniel Day-Lewis",19538,292.54
tt1000925,The Legend 818,2003,R,114,"War, Animation",6.6,72.0,A critically acclaimed war masterpiece.,Spike Lee,"Cate Blanchett, Johnny Depp, Natalie Portman, Anthony Hopkins",41679,
tt1000988,Dark Destiny 881,2008,PG-13,144,Family,6.6,,A family film set in 2008.,Akira Kurosawa,"Kate Winslet, Scarlett Johansson, Edward Norton, Harrison Ford, Jennifer Lawrence",101595,487.1
tt1000268,A Empire 161,2001,R,111,Sci-Fi,6.5,58.0,A critically acclaimed sci-fi masterpiece.,Danny Boyle,"Jennifer Lawrence, Kate Winslet, Christian Bale, Natalie Portman",83550,51.36
tt1000213,Dark Adventures 106,2000,Not Rated,94,"Drama, Documentary, Sci-Fi",6.5,76.0,A critically acclaimed drama masterpiece.,Greta Gerwig,"Chris Hemsworth, Scarlett Johansson, Natalie Portman",731997,
tt1000658,The Quest 551,2013,PG-13,119,"Animation, Horror",6.5,68.0,A critically acclaimed animation masterpiece.,Bong Joon-ho,"Johnny Depp, Jack Nicholson, Natalie Portman",323246,159.82
tt1000832,Lost Kingdom 725,2021,R,114,Thriller,6.5,,A thrilling thriller adventure.,Steven Spielberg,"Denzel Washington, Leonardo DiCaprio, Will Smith, Chris Hemsworth, Kate Winslet",195938,
tt1000424,The Revolution 317,2010,PG-13,98,"Musical, Family",6.5,59.0,An epic musical tale directed by Sam Mendes.,Sam Mendes,"Meryl Streep, Natalie Portman, Scarlett Johansson, Cate Blanchett, Kate Winslet",369404,
tt1000426,Last Adventures 319,2014,PG-13,123,"War, Family",6.5,70.0,A thrilling war adventure.,Akira Kurosawa,"Will Smith, Anthony Hopkins, Tom Hanks, Matt Damon",73153,174.82
tt1000432,Final Revolution 325,2002,PG-13,138,Western,6.5,72.0,An epic western tale directed by Greta Gerwig.,Greta Gerwig,"Christian Bale, Jack Nicholson, Mark Ruffalo",89419,102.29
tt1000595,Dark Destiny 488,2009,PG-13,90,"Horror, Animation",6.5,68.0,A critically acclaimed horror masterpiece.,Alfred Hitchcock,"Gary Oldman, Edward Norton, Johnny Depp, Tom Hanks",19375,479.95
tt1000857,Secret Story 750,2007,R,91,Documentary,6.5,50.0,A documentary film set in 2007.,David Fincher,"Tom Cruise, Robert Downey Jr., Viola Davis",55530,
tt1000276,An Dreams 169,2004,PG,111,Animation,6.5,73.0,A thrilling animation adventure.,Ava DuVernay,"Leonardo DiCaprio, Keanu Reeves, Viola Davis, Amy Adams",7969,10.43
tt1000274,First Journey 167,2008,PG,165,"Mystery, Action",6.5,55.0,An epic mystery tale directed by Clint Eastwood.,Clint Eastwood,"Kate Winslet, Robert De Niro, Viola Davis",30691,
tt1000224,Dark Destiny 117,2016,PG-13,113,Mystery,6.5,72.0,A thrilling mystery adventure.,Frank Darabont,"Matt Damon, Cate Blanchett, Keanu Reeves",7249,
tt1000469,An Secrets 362,2024,PG-13,150,Mystery,6.5,52.0,A critically acclaimed mystery masterpiece.,Edgar Wright,"Mark Ruffalo, Edward Norton, Scarlett Johansson, Samuel L. Jackson, Morgan Freeman",41099,
tt1000648,The Destiny 541,2017,R,132,"Animation, Crime",6.5,53.0,A critically acclaimed animation masterpiece.,Greta Gerwig,"Edward Norton, Keanu Reeves, Tom Hanks, Chris Hemsworth",105413,84.41
tt1000684,Final Awakening 577,2000,PG-13,106,"Action, Romance",6.5,55.0,A critically acclaimed action masterpiece.,James Cameron,"Kate Winslet, Keanu Reeves, Florence Pugh, Amy Adams, Timothée Chalamet",7952,288.18
tt1000642,Final Quest 535,2022,G,70,"Musical, War, Fantasy",6.5,,A critically acclaimed musical masterpiece.,Spike Lee,"Natalie Portman, Gary Oldman, Denzel Washington, Mark Ruffalo, Margot Robbie",312212,442.26
tt1000386,Secret Destiny 279,2022,PG-13,139,"Fantasy, Thriller",6.5,51.0,A thrilling fantasy adventure.,Bong Joon-ho,"Emma Stone, Jack Nicholson, Johnny Depp, Edward Norton",1409,78.59
tt1000928,Dark Love 821,2008,PG,110,"Horror, Adventure, Musical",6.5,,An epic horror tale directed by Ridley Scott.,Ridley Scott,"Jennifer Lawrence, Viola Davis, Anthony Hopkins",18863,
tt1000360,Dark Destiny 253,2008,PG,113,"Western, Mystery, Sci-Fi",6.5,58.0,A thrilling western adventure.,Quentin Tarantino,"Robert Downey Jr., Margot Robbie, Denzel Washington, Robert De Niro, Mark Ruffalo",36958,12.84
tt1000558,The Legend 451,2008,PG-13,152,Drama,6.5,52.0,A critically acclaimed drama masterpiece.,George Lucas,"Johnny Depp, Natalie Portman, Florence Pugh, Morgan Freeman, Tom Hanks",371661,
tt1000288,Final Mission 181,2021,PG,107,Biography,6.5,,A biography film set in 2021.,Ang Lee,"Timothée Chalamet, Emma Stone, Meryl Streep, Jack Nicholson",91931,
tt1000112,Final Dreams 5,1986,PG,103,"Thriller, Drama",6.5,78.0,A critically acclaimed thriller masterpiece.,Akira Kurosawa,"Kate Winslet, Matt Damon, Amy Adams, Mark Ruffalo, Zendaya",66740,247.93
tt1000767,First Story 660,2011,PG-13,100,Comedy,6.5,53.0,A comedy film set in 2011.,David Fincher,"Cate Blanchett, Jennifer Lawrence, Matt Damon, Tom Hanks, Viola Davis",87142,389.56
tt1000303,Lost Dreams 196,2019,Not Rated,163,"Romance, Adventure",6.5,64.0,A critically acclaimed romance masterpiece.,Peter Jackson,"Jennifer Lawrence, Morgan Freeman, Meryl Streep",83176,
tt1000239,A Mission 132,2005,Not Rated,123,"Family, Adventure",6.5,,A critically acclaimed family masterpiece.,Taika Waititi,"Al Pacino, Chris Hemsworth, Margot Robbie",54972,149.35
tt1000413,Final Love 306,2021,PG-13,152,"War, Thriller",6.5,72.0,A war film set in 2021.,Steven Spielberg,"Tom Cruise, Timothée Chalamet, Cate Blanchett, Jack Nicholson",44118,232.17
tt1000785,The Dreams 678,2008,PG-13,125,"Crime, Action",6.5,73.0,An epic crime tale directed by Peter Jackson.,Peter Jackson,"Keanu Reeves, Robert De Niro, Scarlett Johansson, Matt Damon",74241,
tt1000339,Final Mission 232,2007,R,110,Fantasy,6.5,54.0,An epic fantasy tale directed by Greta Gerwig.,Greta Gerwig,"Viola Davis, Mark Ruffalo, Edward Norton, Meryl Streep",113125,65.64
tt1000711,First Love 604,2014,PG,131,Horror,6.5,68.0,An epic horror tale directed by Bong Joon-ho.,Bong Joon-ho,"Robert De Niro, Brad Pitt, Tom Cruise, Chris Hemsworth, Denzel Washington",25326,489.89
tt1000494,Last Story 387,2001,NC-17,154,"Thriller, Mystery",6.4,69.0,An epic thriller tale directed by Coen Brothers.,Coen Brothers,"Morgan Freeman, Robert Downey Jr., Chris Hemsworth, Amy Adams, Samuel L. Jackson",83870,195.76
tt1000557,An Revolution 450,2020,NC-17,112,"Adventure, Romance, Drama",6.4,72.0,A adventure film set in 2020.,Ron Howard,"Meryl Streep, Morgan Freeman, Timothée Chalamet, Zendaya, Amy Adams",15008,
tt1000918,An Kingdom 811,2001,PG,118,Mystery,6.4,,A mystery film set in 2001.,Quentin Tarantino,"Robert De Niro, Jack Nicholson, Leonardo DiCaprio",80220,440.2
tt1000270,The War 163,2013,R,116,"Mystery, Documentary",6.4,57.0,A critically acclaimed mystery masterpiece.,Martin Scorsese,"Harrison Ford, Zendaya, Edward Norton",524639,464.34
tt1000980,An Chronicles 873,2014,PG,139,Biography,6.4,71.0,A thrilling biography adventure.,Spike Lee,"Tom Hanks, Viola Davis, Kate Winslet, Robert Downey Jr.",156485,317.22
tt1000199,The War 92,1995,PG-13,100,"Musical, Biography",6.4,64.0,A thrilling musical adventure.,Martin Scorsese,"Al Pacino, Johnny Depp, Denzel Washington, Will Smith",105445,128.97
tt1000358,Secret Mystery 251,2009,PG-13,139,"Horror, Crime",6.4,,A horror film set in 2009.,Christopher Nolan,"Matt Damon, Gary Oldman, Robert De Niro, Jennifer Lawrence, Viola Davis",5797,92.46
tt1000300,Final War 193,2002,R,127,"Musical, Sci-Fi",6.4,63.0,A thrilling musical adventure.,George Lucas,"Tom Hanks, Robert Downey Jr., Gary Oldman, Harrison Ford, Brad Pitt",62512,145.21
tt1000460,A Journey 353,2015,R,133,"Documentary, War",6.4,65.0,An epic documentary tale directed by Ang Lee.,Ang Lee,"Matt Damon, Florence Pugh, Brad Pitt",1522649,44.22
tt1000680,A War 573,2004,PG-13,106,War,6.4,,An epic war tale directed by Frank Darabont.,Frank Darabont,"Zendaya, Viola Davis, Tom Hanks",27278,170.28
